identifiant	tei:title	marc:titre_propre	site:nom	site:prenom	Nom:majuscules	Nom :capitalisés 	Idref:key	Idref:url	site:promotion	benc:pp	site :tri	site :sexe	site :notBefore	site :notAfter	site :professeur	site :lodel	Commentaire	benc:volume	benc:autorite?	site:id?	Date d'édition	Promotion	TOME	"COTE Thèse AN 
AB XXVIII "	ppn thèse (NC=non catalogué)	Lieu	Début-Fin de période	Dimensions en cm	Cote Thèse BENC	Renseigner : contribue au constat d'état
ENCPOS_1951_12	La décoration marginale française dans les manuscrits du milieu du <abbr>xiii<sup>e</sup></abbr> à la fin du <abbr>xv<sup>e</sup></abbr> siècle	La décoration marginale française dans les manuscrits du milieu du xiiie à la fin du xve siècle	Henry	Suzanne	SUZANNE HENRY	Suzanne Henry			1951	79-83	henry	2	1250	1499				16-1950-1953	Henry, Suzanne	195112		1951			NC		1250-1499			bon état
ENCPOS_1951_13	Les institutions communales de la ville de Chauny (1166-1565)	Les institutions communales de la ville de Chauny (1166-1565)	Houriez	Élisabeth	ÉLISABETH HOURIEZ	Élisabeth Houriez			1951	85-90	houriez	2	1166	1565				16-1950-1953	Houriez, Élisabeth	195113		1951			NC		1166-1565			bon état
ENCPOS_1951_14	Le retour de Lyon sous l’autorité royale à la fin des guerres_de_Religion (1593-1597)	Le retour de Lyon sous l’autorité royale à la fin des guerres de Religion (1593-1597)	Hours	Henri	HENRI HOURS	Henri Hours			1951	91-95	hours	1	1593	1597				16-1950-1953	Hours, Henri	195114		1951			NC		1593-1597			bon état
ENCPOS_1951_15	Les emblèmes profanes à Paris au <abbr>xvi<sup>e</sup></abbr> siècle	Les emblèmes profanes à Paris au xvie siècle	Huon	Antoinette	ANTOINETTE HUON	Antoinette Huon			1951	97-102	huon	2	1500	1599				16-1950-1953	Huon, Antoinette	195115		1951			NC		1500-1599			bon état
ENCPOS_1951_16	La communauté des prêtres-filleuls de l’église Notre-Dame_d_Aurillac du <abbr>xiii<sup>e</sup></abbr> siècle à la Révolution	La communauté des prêtres-filleuls de l’église Notre-Dame d'Aurillac du xiiie siècle à la Révolution	Léotoing D’anjony, De	Georges	GEORGES DE LÉOTOING D’ANJONY	Georges de Léotoing d’Anjony			1951	103-106	leotoingdanjony	1	1200	1789				16-1950-1953	Léotoing D’anjony, De, Georges	195118		1951			NC		1200-1789			bon état
ENCPOS_1951_17	Le <i>Speculum_universale</i> de Raoul_Ardent	Le « Speculum universale » de Raoul Ardent	Le Paul	Michèle	MICHÈLE LE PAUL	Michèle Le Paul			1951	107-109	lepaul	2	1150	1199				16-1950-1953	Le Paul, Michèle	195116		1951			NC		1150-1199			bon état
ENCPOS_1951_18	Catalogue des actes des ducs de Normandie de 911 à 1066	Catalogue des actes des ducs de Normandie de 911 à 1066	Le Roy Ladurie	Marie	MARIE LE ROY LADURIE	Marie Le Roy Ladurie			1951	111-112	leroyladurie	2	911	1066				16-1950-1953	Le Roy Ladurie, Marie	195117		1951			NC		911-1066			bon état
ENCPOS_1951_19	Albert_de_Gondi, maréchal de Retz (1522-1602)	Albert de Gondi, maréchal de Retz (1522-1602)	Montéty, De	Marie-Henriette	MARIE-HENRIETTE DE MONTÉTY	Marie-Henriette de Montéty			1951	113-120	montety	2	1522	1602				16-1950-1953	Montéty, De, Marie-Henriette	195119		1951			NC		1522-1602			bon état
ENCPOS_1951_20	Le rattachement de la Normandie à la couronne de France	Le rattachement de la Normandie à la couronne de France	Nortier	Michel	MICHEL NORTIER	Michel Nortier			1951	121-126	nortier	1	1204	1204				16-1950-1953	Nortier, Michel	195120		1951			NC		1204-1204			bon état
ENCPOS_1951_21	La pénétration du régie français en Bordelais de 1453 à 1461	La pénétration du régime français en Bordelais de 1453 à 1461	Peyrègne	Antoine	ANTOINE PEYRÈGNE	Antoine Peyrègne			1951	127-132	peyregne	1	1453	1461				16-1950-1953	Peyrègne, Antoine	195121		1951			NC		1453-1461			bon état
ENCPOS_1951_22	Recherches sur l’histoire du vignoble champenois	Recherches sur l’histoire du vignoble champenois	Rocher	Jean-Louis	JEAN-LOUIS ROCHER	Jean-Louis Rocher			1951	133-139	rocher	1	500	1951				16-1950-1953	Rocher, Jean-Louis	195122		1951			NC		500-1951			bon état
ENCPOS_1951_23	L’architecture religieuse à l’époque romane dans les anciens diocèses de Provence orientale	L’architecture religieuse à l’époque romane dans les anciens diocèses de Provence orientale	Thirion	Jacques	JACQUES THIRION	Jacques Thirion			1951	141-145	thirion	1	1030	1150				16-1950-1953	Thirion, Jacques	195123		1951			NC		1030-1150			bon état
ENCPOS_1951_24	Les comtes de Ferrette et leur seigneurie du début du <abbr>xii<sup>e</sup></abbr> siècle à 1324	Les comtes de Ferrette et leur seigneurie du début du xiie siècle à 1324	Wilsdorf	Christian	CHRISTIAN WILSDORF	Christian Wilsdorf			1951	147-151	wilsdorf	1	1100	1324				16-1950-1953	Wilsdorf, Christian	195124		1951			NC		1100-1324			bon état
ENCPOS_1951_NEXT		pages postliminaires							1951	-153								16-1950-1953												
ENCPOS_1951_PREV		pages liminaires							1951	0-10								16-1950-1953												
ENCPOS_1952_01	L’abbaye Saint-Pierre de Moissac des origines au début du <abbr>xiv<sup>e</sup></abbr> siècle	L’abbaye Saint-Pierre de Moissac des origines au début du xive siècle	Barlangue	Claude-Gabrielle	CLAUDE-GABRIELLE BARLANGUE	Claude-Gabrielle Barlangue			1952	11-15	barlangue	2	506	1350				16-1950-1953	Barlangue, Claude-Gabrielle	195201		1952			NC		506-1350			bon état
ENCPOS_1952_02	L’abbaye Saint-Melaine de Rennes des origines à la Révolution	L’abbaye Saint-Melaine de Rennes des origines à la Révolution	Bernard	Gildas	GILDAS BERNARD	Gildas Bernard			1952	17-21	bernard	1	500	1789				16-1950-1953	Bernard, Gildas	195202		1952			NC		500-1789			bon état
ENCPOS_1952_03	L’amandellerie. Diplomatique de l’acte privé messin du Bas_Moyen_Âge	L’amandellerie. Diplomatique de l’acte privé messin du Bas_Moyen_Âge	Cahen	Gilbert	GILBERT CAHEN	Gilbert Cahen			1952	23-27	cahen	1	500	1099				16-1950-1953	Cahen, Gilbert	195203		1952			NC		500-1099			bon état
ENCPOS_1952_04	Les orfèvres de Paris et leur corporation du <abbr>xiii<sup>e</sup></abbr> au <abbr>xvii<sup>e</sup></abbr> siècle	Les orfèvres de Paris et leur corporation du xiiie au xviie siècle	Charnier	Henri	HENRI CHARNIER	Henri Charnier			1952	29-33	charnier	1	1200	1699				16-1950-1953	Charnier, Henri	195204		1952			NC		1200-1699			bon état
ENCPOS_1952_05	La fin des corporations parisiennes (1776-1791)	La fin des corporations parisiennes (1776-1791)	Féline, De	Bernadette	BERNADETTE DE FÉLINE	Bernadette de Féline			1952	35-39	feline	2	1776	1791				16-1950-1953	Féline, De, Bernadette	195205		1952			NC		1776-1791			bon état
ENCPOS_1952_06	La religion catholique à Paris au <abbr>xvii<sup>e</sup></abbr> siècle	La religion catholique à Paris au xviie siècle	Garaud	Janine	JANINE GARAUD	Janine Garaud			1952	41-45	garaud	2	1600	1699				16-1950-1953	Garaud, Janine	195206		1952			NC		1600-1699			bon état
ENCPOS_1952_07	Le pariage et le bourg de Luxeuil jusqu’au milieu du <abbr>xvi<sup>e</sup></abbr> siècle	Le pariage et le bourg de Luxeuil jusqu’au milieu du xvie siècle	Gérard	Pierre	PIERRE GÉRARD	Pierre Gérard			1952	47-50	gerard	1	500	1599				16-1950-1953	Gérard, Pierre	195207		1952			NC		500-1599			bon état
ENCPOS_1952_08	Les états du Languedoc au <abbr>xv<sup>e</sup></abbr> siècle	Les états du Languedoc au xve siècle	Gilles	Henri	HENRI GILLES	Henri Gilles			1952	51-54	gilles	1	1400	1499				16-1950-1953	Gilles, Henri	195208		1952			NC		1400-1499			bon état
ENCPOS_1952_09	L’agriculture dans le Haut-Maine à la fin de l’Ancien_Régime (1750-1789)	L’agriculture dans le Haut-Maine à la fin de l’Ancien_Régime (1750-1789)	Giraud	René	RENÉ GIRAUD	René Giraud			1952	55-59	giraud	1	1750	1789				16-1950-1953	Giraud, René	195209		1952			NC		1750-1789			bon état
ENCPOS_1952_10	La chronique d’Yves_de_Saint-Denis	La chronique d’Yves de Saint-Denis	Grémont	Bernard	BERNARD GRÉMONT	Bernard Grémont			1952	61-62	gremont	1	1268	1314				16-1950-1953	Grémont, Bernard	195210		1952			NC		1268-1314			bon état
ENCPOS_1952_11	Le chemin dans la toponymie du midi de la France	Le chemin dans la toponymie du midi de la France	Guibert	Monique	MONIQUE GUIBERT	Monique Guibert			1952	63-67	guibert	2	-500	1952				16-1950-1953	Guibert, Monique	195211		1952			NC		-500-1952			bon état
ENCPOS_1952_12	Les missions du diplomate Hercule_de_Charnacé de 1629 à 1633	Les missions du diplomate Hercule_de_Charnacé de 1629 à 1633	Lemée	Bernard	BERNARD LEMÉE	Bernard Lemée			1952	69-72	lemee	1	1629	1633				16-1950-1953	Lemée, Bernard	195212		1952			NC		1629-1633			bon état
ENCPOS_1952_13	Les seigneurs de Beaujeu du <abbr>x<sup>e</sup></abbr> siècle à 1400	Les seigneurs de Beaujeu du xe siècle à 1400	Méras	Mathieu	MATHIEU MÉRAS	Mathieu Méras			1952	73-77	meras	1	900	1400				16-1950-1953	Méras, Mathieu	195213		1952			NC		900-1400			bon état
ENCPOS_1952_14	La vie et l’œuvre de dom Luc d’Achery, religieux bénédictin de la Congrégation de Saint-Maur (1609-1685)	La vie et l’œuvre de dom Luc d’Achery, religieux bénédictin de la Congrégation de Saint-Maur (1609-1685)	Millaud	Jeannine	JEANNINE MILLAUD	Jeannine Millaud			1952	79-82	millaud	2	1609	1685				16-1950-1953	Millaud, Jeannine	195214		1952			NC		1609-1685			bon état
ENCPOS_1952_15	Recherches sur l’histoire du Pont-au-Change	Recherches sur l’histoire du Pont-au-Change	Morin	Marie-Renée	MARIE-RENÉE MORIN	Marie-Renée Morin			1952	83-86	morin	2	500	1499				16-1950-1953	Morin, Marie-Renée	195215		1952			NC		500-1499			bon état
ENCPOS_1952_16	<i>La_Voie_d_Enfer_et_de_Paradis</i>, poème du <abbr>xiv<sup>e</sup></abbr> siècle	La « Voie d'Enfer et de Paradis », poème du xive siècle	Piezzoli	Thérèse	THÉRÈSE PIEZZOLI	Thérèse Piezzoli			1952	87-90	piezzoli	2	1300	1399				16-1950-1953	Piezzoli, Thérèse	195216		1952			NC		1300-1399			bon état
ENCPOS_1952_17	Le rôle de l’ambassadeur Barthélemy dans les rapports franco-helvétiques en 1793	Le rôle de l’ambassadeur Barthélemy dans les rapports franco-helvétiques en 1793	Santschy	Jean-Louis	JEAN-LOUIS SANTSCHY	Jean-Louis Santschy			1952	91-95	santschy	1	1793	1793				16-1950-1953	Santschy, Jean-Louis	195217		1952			NC		1793-1793			bon état
ENCPOS_1952_18	L’abbaye de Saint-Maurice_d_Agaune, des origines à la réforme canoniale (515-830)	L’abbaye de Saint-Maurice d'Agaune, des origines à la réforme canoniale (515-830)	Theurillat	Jean-Marie	JEAN-MARIE THEURILLAT	Jean-Marie Theurillat			1952	97-102	theurillat	1	515	830				16-1950-1953	Theurillat, Jean-Marie	195218		1952			NC		515-830			bon état
ENCPOS_1952_NEXT		pages postliminaires							1952	-103								16-1950-1953												
ENCPOS_1952_PREV		pages liminaires							1952	0-10								16-1950-1953												
ENCPOS_1953_01	La mise en prose du roman de <i>Blancandin_et_l_Orgueilleuse_d_Amour</i>	La mise en prose du roman de « Blancandin et l'Orgueilleuse d'Amour »	Bernard	Claude-Georgette	CLAUDE-GEORGETTE BERNARD	Claude-Georgette Bernard			1953	11-14	bernard	2	1275	1325				16-1950-1953	Bernard, Claude-Georgette	195301		1953			NC		1275-1325			bon état
ENCPOS_1953_02	Recherches sur le testament en Forez du début du <abbr>xiii<sup>e</sup></abbr> au début du <abbr>xiv<sup>e</sup></abbr> siècle	Recherches sur le testament en Forez du début du xiiie au début du xive siècle	Boyer	Laurent	LAURENT BOYER	Laurent Boyer			1953	15-18	boyer	1	1200	1350				16-1950-1953	Boyer, Laurent	195303		1953			NC		1200-1350			bon état
ENCPOS_1953_03	Les  commissaires royaux aux amortissements et aux nouveaux acquêts sous les Capétiens (1275-1328)	Les  commissaires royaux aux amortissements et aux nouveaux acquêts sous les Capétiens (1275-1328)	Carreau	Marie-Élisabeth	MARIE-ÉLISABETH CARREAU	Marie-Élisabeth Carreau			1953	19-22	carreau	2	1275	1328				16-1950-1953	Carreau, Marie-Élisabeth	195304		1953			NC		1275-1328			bon état
ENCPOS_1953_04	La ville de Saint-Denis du <abbr>xiii<sup>e</sup></abbr> siècle à la fin du <abbr>xvii<sup>e</sup></abbr> siècle. Étude topographique	La ville de Saint-Denis du xiiie siècle à la fin du xviie siècle. Étude topographique	Coural	Jean	JEAN COURAL	Jean Coural			1953	23-26	coural	1	1200	1699				16-1950-1953	Coural, Jean	195305		1953			NC		1200-1699			bon état
ENCPOS_1953_05	Le <i>Speculum_Phisionomie</i> de Michel_Savonarole et ses sources	Le « Speculum Phisionomie » de Michel Savonarole et ses sources	Denieul-Cormier	Anne	ANNE DENIEUL-CORMIER	Anne Denieul-Cormier			1953	17-31	denieul	2	1452	1498				16-1950-1953	Denieul-Cormier, Anne	195306		1953			NC		1452-1498			bon état
ENCPOS_1953_06	L’église collégiale et la confrérie du Saint-Sépulcre à Paris (1325-1791)	L’église collégiale et la confrérie du Saint-Sépulcre à Paris (1325-1791)	Boisrouvray, Du	Xavier	XAVIER DU BOISROUVRAY	Xavier Du Boisrouvray			1953	33-35	boisrouvray	1	1325	1791				16-1950-1953	Boisrouvray, Du, Xavier	195302		1953			NC		1325-1791			bon état
ENCPOS_1953_07	Étude sur les chartes de Saint-Martin-de-Tours des origines au milieu du <abbr>xii<sup>e</sup></abbr> siècle	Étude sur les chartes de Saint-Martin-de-Tours des origines au milieu du xii siècle	Gasnault	Pierre	PIERRE GASNAULT	Pierre Gasnault			1953	37-40	gasnault	1	437	1180				16-1950-1953	Gasnault, Pierre	195307		1953			NC		437-1180			bon état
ENCPOS_1953_08	La ville de Nevers du milieu du <abbr>xvi<sup>e</sup></abbr> siècle au milieu du <abbr>xvii<sup>e</sup></abbr> siècle	La ville de Nevers du milieu du xvie au milieu du xviie siècle	Gourhand	Jean	JEAN GOURHAND	Jean Gourhand			1953	41-46	gourhand	1	1550	1650				16-1950-1953	Gourhand, Jean	195308		1953			NC		1550-1650			bon état
ENCPOS_1953_09	L’<i>Abrégé_des_Chroniques_de_France</i> de Noël_de_Fribois	L’  « Abrégé des Chroniques de France » de Noël de Fribois	Labat	Alexandre	ALEXANDRE LABAT	Alexandre Labat			1953	47-49	labat	1	1450	1499				16-1950-1953	Labat, Alexandre	195309		1953			NC		1450-1499			bon état
ENCPOS_1953_10	La participation de François_de_Meyronnes à la querelle_de_la_Pauvreté (1322-1324)	La participation de François de Meyronnes à la querelle de la Pauvreté (1322-1324)	Lagarde, De	Jacqueline	JACQUELINE DE LAGARDE	Jacqueline de Lagarde			1953	51-54	lagarde	2	1322	1324				16-1950-1953	Lagarde, De, Jacqueline	195310		1953			NC		1322-1324			bon état
ENCPOS_1953_11	Le développement du Faubourg_Saint-Honoré à Paris au <abbr>xviii<sup>e</sup></abbr> siècle	Le développement du Faubourg Saint-Honoré à Paris au xviiie siècle	Lemaire	Élisabeth-Thérèse	ÉLISABETH-THÉRÈSE LEMAIRE	Élisabeth-Thérèse Lemaire			1953	55-59	lemaire	2	1700	1799				16-1950-1953	Lemaire, Élisabeth-Thérèse	195311		1953			NC		1700-1799			bon état
ENCPOS_1953_12	Les missions d’Hercule_de_Charnacé de 1629 à 1633	Les missions d’Hercule de Charnacé de 1629 à 1633	Lemée	Bernard	BERNARD LEMÉE	Bernard Lemée			1953	61-64	lemee	1	1629	1633				16-1950-1953	Lemée, Bernard	195312		1953			NC		1629-1633			bon état
ENCPOS_1953_13	Le temporel de l’abbaye de Fécamp des origines à la fin du <abbr>xiii<sup>e</sup></abbr> siècle	Le temporel de l’abbaye de Fécamp des origines à la fin du xiiie siècle	Mabille	Micheline	MICHELINE MABILLE	Micheline Mabille			1953	65-68	mabille	2	659	1299				16-1950-1953	Mabille, Micheline	195313		1953			NC		659-1299			bon état
ENCPOS_1953_14	Les subdélégués de l’intendance de Riom au <abbr>xviii<sup>e</sup></abbr> siècle	Les subdélégués de l’intendance de Riom au xviiie siècle	Malavialle	Geneviève	GENEVIÈVE MALAVIALLE	Geneviève Malavialle			1953	69-72	malavialle	2	1700	1799				16-1950-1953	Malavialle, Geneviève	195314		1953			NC		1700-1799			bon état
ENCPOS_1953_15	Le coutumier bourguignon de la Bibliothèque nationale	Le coutumier bourguignon de la Bibliothèque nationale	Marchand-Thébault	Marie-Louise	MARIE-LOUISE MARCHAND-THÉBAULT	Marie-Louise Marchand-Thébault			1953	73-75	marchand	2	1350	1499				16-1950-1953	Marchand-Thébault, Marie-Louise	195315		1953			NC		1350-1499			bon état
ENCPOS_1953_16	Jean_Beleth et la <i>Summa_de_ecclesiasticis_officiis</i>	Jean Beleth et la « Summa de ecclesiasticis officiis »	Maurel	Jean-François	JEAN-FRANÇOIS MAUREL	Jean-François Maurel			1953	77-80	maurel	1	1135	1182				16-1950-1953	Maurel, Jean-François	195316		1953			NC		1135-1182			bon état
ENCPOS_1953_17	Les bibliothèques médiévales des abbayes bénédictines de Normandie	Les bibliothèques médiévales des abbayes bénédictines de Normandie	Nortier-Marchand	Geneviève	GENEVIÈVE NORTIER-MARCHAND	Geneviève Nortier-Marchand			1953	81-86	nortier	2	500	1499				16-1950-1953	Nortier-Marchand, Geneviève	195317		1953			NC		500-1499			bon état
ENCPOS_1953_18	Les monnaies féodales d’Artois du <abbr>x<sup>e</sup></abbr> au début du <abbr>xiv<sup>e</sup></abbr> siècle	Les monnaies féodales d’Artois du xe au début du xive siècle	Richebé	Claude	CLAUDE RICHEBÉ	Claude Richebé			1953	87-91	richebe		900	1350				16-1950-1953	Richebé, Claude	195318		1953			NC		900-1350			bon état
ENCPOS_1953_19	Les relations commerciales et politiques de Venise avec l’Egypte aux <abbr>xiv<sup>e</sup></abbr> et <abbr>xv<sup>e</sup></abbr> siècles	Les relations commerciales et politiques de Venise avec l’Égypte aux xive et xve siècles	Tewfik	Iskandar	ISKANDAR TEWFIK	Iskandar Tewfik			1953	93-95	tewfik		1300	1499				16-1950-1953	Tewfik, Iskandar	195319		1953			NC		1300-1499			bon état
ENCPOS_1953_NEXT		pages postliminaires							1953	-97								16-1950-1953												
ENCPOS_1953_PREV		pages liminaires							1953	0-10								16-1950-1953												
ENCPOS_1954_01	La demeure parisienne sous Henri_IV et Louis_XIII	La demeure parisienne sous Henri IV et Louis XIII	Babelon	Jean-Pierre	JEAN-PIERRE BABELON	Jean-Pierre Babelon			1954	11-14	babelon	1	1589	1643				17-1954-1957	Babelon, Jean-Pierre	195401		1954			NC		1589-1643			bon état
ENCPOS_1954_02	<i>L_art_d_amour</i>. Traduction en prose de l’<i>Ars_amatoria</i> d’Ovide	L' « art d'amour ». Traduction en prose de l’ « Ars amatoria » d’Ovide	Bordas	Jeannine	JEANNINE BORDAS	Jeannine Bordas			1954	15-17	bordas	2	1500	1550				17-1954-1957	Bordas, Jeannine	195402		1954			NC		1500-1550			bon état
ENCPOS_1954_03	Le chapitre métropolitain de Besançon de 1253 à 1545	Le chapitre métropolitain de Besançon de 1253 à 1545	Burel	Thérèse	THÉRÈSE BUREL	Thérèse Burel			1954	19-23	burel	2	1253	1545				17-1954-1957	Burel, Thérèse	195403		1954			NC		1253-1545			bon état
ENCPOS_1954_04	Géographie historique du comté d’Angoulême de 1308 à 1531	Géographie historique du comté d’Angoulême de 1308 à 1531	Burias	Jean	JEAN BURIAS	Jean Burias			1954	25-30	burias	1	1308	1531				17-1954-1957	Burias, Jean	195404		1954			NC		1308-1531			bon état
ENCPOS_1954_05	La faculté de droit de l’université de Toulouse au <abbr>xvi<sup>e</sup></abbr> siècle	La faculté de droit de l’université de Toulouse au xvie siècle	Debant	Robert	ROBERT DEBANT	Robert Debant			1954	31-35	derant	1	1500	1599				17-1954-1957	Debant, Robert	195407		1954			NC		1500-1599			bon état
ENCPOS_1954_06	<i>La_Muse</i> de Raoul_de_Presles. Étude et édition	La « Muse » de Raoul de Presles. Étude et édition	Decanter	Jacques	JACQUES DECANTER	Jacques Decanter			1954	37-41	decanter	1	1316	1383				17-1954-1957	Decanter, Jacques	195405		1954			NC		1316-1383			bon état
ENCPOS_1954_07	Les variations territoriales de la seigneurie épiscopale de Metz entre 962 et 1415	Les variations territoriales de la seigneurie épiscopale de Metz entre 962 et 1415	Depoux	Michèle	MICHÈLE DEPOUX	Michèle Depoux			1954	43-49	depoux	2	962	1415				17-1954-1957	Depoux, Michèle	195406		1954			NC		962-1415			bon état
ENCPOS_1954_08	Les relations de Charles-Emmanuel_I<sup>er</sup>, duc de Savoie, avec la Ligue (1584-1598)	Les relations de Charles-Emmanuel Ier, duc de Savoie, avec la Ligue (1584-1598)	Dufour	Alain	ALAIN DUFOUR	Alain Dufour			1954	51-54	dufour	1	1584	1598				17-1954-1957	Dufour, Alain	195408		1954			NC		1584-1598			bon état
ENCPOS_1954_09	L’iconographie de la musique à l’époque gothique	L’iconographie de la musique à l’époque gothique	Ferrand	Jeannine	JEANNINE FERRAND	Jeannine Ferrand			1954	55-59	ferrand	2	1150	1350				17-1954-1957	Ferrand, Jeannine	195409		1954			NC		1150-1350			bon état
ENCPOS_1954_10	Étienne Poncher, évêque de Paris, archevêque de Sens (1446-1525)	Étienne Poncher, évêque de Paris, archevêque de Sens (1446-1525)	Garand-Zobel	Monique	MONIQUE GARAND-ZOBEL	Monique Garand-Zobel			1954	61-71	garand	2	1446	1525				17-1954-1957	Garand-Zobel, Monique	195410		1954			NC		1446-1525			bon état
ENCPOS_1954_11	<i>Le_songe_du_vieil_pèlerin</i> de Philippe_de_Mézières. Étude et édition	« Le songe du vieil pèlerin » de Philippe de Mézières. Étude et édition	Guillemain	Alice	ALICE GUILLEMAIN	Alice Guillemain			1954	73-77	guillemain	2	1389	1389				17-1954-1957	Guillemain, Alice	195411		1954			NC		1389-1389			bon état
ENCPOS_1954_12	Le régime seigneurial au Canada de 1626 à 1760	Le régime seigneurial au Canada de 1626 à 1760	Jenner-Le Grontec	Marie-Françoise	MARIE-FRANÇOISE JENNER-LE GRONTEC	Marie-Françoise Jenner-Le Grontec			1954	79-81	jenner	2	1626	1760				17-1954-1957	Jenner-Le Grontec, Marie-Françoise	195412		1954			NC		1626-1760			bon état
ENCPOS_1954_13	Les savants dans l’expédition française d’Egypte, 1798-1801	Les savants dans l’expédition française d’Égypte (1798-1801)	Laissus	Yves	YVES LAISSUS	Yves Laissus			1954	83-88	laissus	1	1798	1801				17-1954-1957	Laissus, Yves	195413		1954			NC		1798-1801			bon état
ENCPOS_1954_14	Recherches sur la musique du roi de 1600 à 1660	Recherches sur la musique du roi de 1600 à 1660	Le Moël	Michel	MICHEL LE MOËL	Michel Le Moël			1954	89-92	lemoel	1	1600	1660				17-1954-1957	Le Moël, Michel	195414		1954			NC		1600-1660			bon état
ENCPOS_1954_15	Le cardinal Élie_de_Bourdeilles, archevêque de Tours, chapelain et confesseur de Louis_XI (1413-1484)	Le cardinal Élie de Bourdeilles, archevêque de Tours, chapelain et confesseur de Louis XI (1413-1484)	Michel	Henri	HENRI MICHEL	Henri Michel			1954	93-97	michel	1	1413	1484				17-1954-1957	Michel, Henri	195415		1954			NC		1413-1484			bon état
ENCPOS_1954_16	La population de la Guyane française au <abbr>xviii<sup>e</sup></abbr> siècle	La population de la Guyane française au xviiie siècle	Mirot	Sylvie	SYLVIE MIROT	Sylvie Mirot			1954	99-104	mirot	2	1700	1799				17-1954-1957	Mirot, Sylvie	195416		1954			NC		1700-1799			bon état
ENCPOS_1954_17	Les États de Comminges aux <abbr>xvi<sup>e</sup></abbr> et <abbr>xvii<sup>e</sup></abbr> siècles	Les États de Comminges aux xvie et xviie siècles	Naurois-Destenay, De	Marie-José	MARIE-JOSÉ DE NAUROIS-DESTENAY	Marie-José de Naurois-Destenay			1954	105-111	naurois	2	1500	1699				17-1954-1957	Naurois-Destenay, De, Marie-José	195417		1954			NC		1500-1699			bon état
ENCPOS_1954_18	Le diocèse de Lisieux de 1715 à 1783	Le diocèse de Lisieux de 1715 à 1783	Nédélec	Yves	YVES NÉDÉLEC	Yves Nédélec			1954	113-117	nedelec	1	1715	1783				17-1954-1957	Nédélec, Yves	195418		1954			NC		1715-1783			bon état
ENCPOS_1954_19	Recherches sur les traités médiévaux d’instruments astronomiques d’observation	Recherches sur les traités médiévaux d’instruments astronomiques d’observation	Poulle	Emmanuel	EMMANUEL POULLE	Emmanuel Poulle			1954	119-128	poulle	1	800	1499				17-1954-1957	Poulle, Emmanuel	195419		1954			NC		800-1499			bon état
ENCPOS_1954_20	Les métiers d’Auxerre du milieu du <abbr>xvii<sup>e</sup></abbr> siècle à la Révolution	Les métiers d’Auxerre du milieu du xviie siècle à la Révolution	Quincy	Guy	GUY QUINCY	Guy Quincy			1954	125-130	quincy	1	1650	1789				17-1954-1957	Quincy, Guy	195420		1954			NC		1650-1789			bon état
ENCPOS_1954_21	La vie maritime en Bas-Poitou du <abbr>x<sup>e</sup></abbr> à la fin du <abbr>xv<sup>e</sup></abbr> siècle	La vie maritime en Bas-Poitou du xe à la fin du xve siècle	Reverseau	Marguerite	MARGUERITE REVERSEAU	Marguerite Reverseau			1954	131-134	reverseau	2	900	1499				17-1954-1957	Reverseau, Marguerite	195421		1954			NC		900-1499			bon état
ENCPOS_1954_22	Les seigneurs de Picquigny, vidames d’Amiens, et leur famille, des origines à la fin du <abbr>xiv<sup>e</sup></abbr> siècle	Les seigneurs de Picquigny, vidames d’Amiens, et leur famille, des origines à la fin du xive siècle	Tourtier, De	Chantal	CHANTAL DE TOURTIER	Chantal de Tourtier			1954	135-138	tourtier	2	1000	1399				17-1954-1957	Tourtier, De, Chantal	195422		1954			NC		1000-1399			bon état
ENCPOS_1954_NEXT		pages postliminaires							1954	-139								17-1954-1957												
ENCPOS_1954_PREV		pages liminaires							1954	0-10								17-1954-1957												
ENCPOS_1955_01	Le commerce français en Espagne pendant l’ambassade de Vauréal de 1741 à 1746	Le commerce français en Espagne pendant l’ambassade de Vauréal de 1741 à 1746	Adam	Françoise	FRANÇOISE ADAM	Françoise Adam			1955	11-16	adam	2	1741	1746				17-1954-1957	Adam, Françoise	195501		1955			NC		1741-1746			bon état
ENCPOS_1955_02	Le quartier de Saint-Merry de Paris, des origines à la Révolution	Le quartier de Saint-Merry de Paris, des origines à la Révolution	Bingrand	Anne-Marie	ANNE-MARIE BINGRAND	Anne-Marie Bingrand			1955	17-20	bingrand	2	500	1789				17-1954-1957	Bingrand, Anne-Marie	195502		1955			NC		500-1789			bon état
ENCPOS_1955_03	Les foires de Saint-Denis sous l’Ancien_Régime	Les foires de Saint-Denis sous l’Ancien_Régime	Carrara	Suzanne	SUZANNE CARRARA	Suzanne Carrara			1955	21-24	carrara	2	1500	1789				17-1954-1957	Carrara, Suzanne	195503		1955			NC		1500-1789			bon état
