identifiant	tei:title	marc:titre_propre	site:nom	site:prenom	Nom:majuscules	Nom :capitalisés 	Idref:key	Idref:url	site:promotion	benc:pp	site :tri	site :sexe	site :notBefore	site :notAfter	site :professeur	site :lodel	Commentaire	benc:volume	benc:autorite?	site:id?	Date d'édition	Promotion	TOME	"COTE Thèse AN 
AB XXVIII "	ppn thèse (NC=non catalogué)	Lieu	Début-Fin de période	Dimensions en cm	Cote Thèse BENC	Renseigner : contribue au constat d'état
ENCPOS_1906_09	Étude sur les forêts du Nivernais particulièrement du quinzième à la fin du <abbr>xviii<sup>e</sup></abbr> siècle	Étude sur les forêts du Nivernais, particulièrement du xve à la fin du xviiie siècle	Cornu	Paul	Paul CORNU	Paul Cornu			1906	69-74	cornu	1	1400	1799				8-1906-1910	Cornu, Paul	190610		1906			NC		1400-1799			bon état
ENCPOS_1906_10	Vie et œuvres de Michel_Vascoan, imprimeur à Paris (de 1532 à 1577)	Vie et œuvres de Michel Vascoan, imprimeur à Paris (de 1532 à 1577)	Bus	Charles du	Charles DU BUS	Charles Du Bus			1906	75-80	bus	1	1532	1577				8-1906-1910	Bus, Charles du	190604		1906			NC		1532-1577			bon état
ENCPOS_1906_11	Essai sur Jacques_de_Molay, dernier grand maître des Templiers (1244?-18 mars 1314)	Essai sur Jacques de Molay, dernier grand maître des Templiers (1244?-18 mars 1314)	Dugueyt	Paul	Paul DUGUEYT	Paul Dugueyt			1906	81-82	dugueyt	1	1244	1344				8-1906-1910	Dugueyt, Paul	190611		1906			NC		1244-1344			bon état
ENCPOS_1906_12	L’histoire de la ville de Vienne aux <abbr>xiv<sup>e</sup></abbr> et <abbr>xv<sup>e</sup></abbr> siècles (1328-1454)	Histoire de la ville de Vienne aux xive et xve siècles (1328-1454)	Faure	Claude	Claude FAURE	Claude Faure			1906	83-93	faure		1328	1454				8-1906-1910	Faure, Claude	190612		1906			NC		1328-1454			bon état
ENCPOS_1906_13	Étude historique et biographique sur Étienne_de_Tournai d’après sa correspondance	Étude historique et biographique sur Étienne de Tournai d’après sa correspondance	Fazy	Max	Max FAZY	Max Fazy			1906	95-105	fazy	1	1128	1203				8-1906-1910	Fazy, Max	190613		1906			NC		1128-1203			bon état
ENCPOS_1906_14	La cité de Limoges. Son évêque, son chapitre, son consulat (XII<sup>e</sup>-XVIII<sup>e</sup> siècles)	La cité de Limoges. Son évêque, son chapitre, son consulat (xiie-xviiie siècles)	Grenier	Paul-Louis	Paul-Louis GRENIER	Paul-Louis Grenier			1906	107-113	grenier	1	1100	1799				8-1906-1910	Grenier, Paul-Louis	190614		1906			NC		1100-1799			bon état
ENCPOS_1906_15	L’impôt royal sous Philippe_le_Bel (1292-1304)	L’impôt royal sous Philippe le Bel (1292-1304)	Jusselin	Maurice	Maurice JUSSELIN	Maurice Jusselin			1906	115-128	jusselin	1	1292	1304				8-1906-1910	Jusselin, Maurice	190615		1906			NC		1292-1304			bon état
ENCPOS_1906_16	Recherches sur la vie et l’œuvre de Nicolas_de_Lire de l’ordre des frères mineurs	Recherches sur la vie et l’œuvre de Nicolas de Lire de l’ordre des frères mineurs	Labrosse	Henri	Henri LABROSSE	Henri Labrosse			1906	129-139	labrosse	1	1260	1350				8-1906-1910	Labrosse, Henri	190616		1906			NC		1260-1350			bon état
ENCPOS_1906_17	Étude archéologique des ruines de l’abbaye de Jumièges (Seine inférieure)	Étude archéologique des ruines de l’abbaye de Jumièges (Seine inférieure)	Martin Du Gard	Roger	Roger MARTIN DU GARD	Roger Martin Du Gard			1906	141-150	martindugard	1	-500	1906				8-1906-1910	Martin Du Gard, Roger	190617		1906			NC		-500-1906			bon état
ENCPOS_1906_18	L’abbaye de Saint-Remi de Reims depuis le <abbr>xi<sup>e</sup></abbr> siècle jusqu’à la commende (1473) : son organisation intérieure et son pouvoir temporel	L’abbaye de Saint-Remi de Reims depuis le xie siècle jusqu’à la commende (1473) : son organisation intérieure et son pouvoir temporel	Robert	Gaston	Gaston ROBERT	Gaston Robert			1906	151-155	robert	1	1000	1473				8-1906-1910	Robert, Gaston	190618		1906			NC		1000-1473			bon état
ENCPOS_1906_NEXT		pages postliminaires							1906	-157								8-1906-1910												
ENCPOS_1906_PREV		pages liminaires							1906	0								8-1906-1910												
ENCPOS_1907_01	La cathédrale de Senlis : étude archéologique	La cathédrale de Senlis : étude archéologique	Aubert	Marcel	Marcel AUBERT	Marcel Aubert			1907	1-9	aubert	1	1151	1499				8-1906-1910	Aubert, Marcel	190701		1907			NC		1151-1499			bon état
ENCPOS_1907_02	Les origines de l’intendance de Bretagne	Les origines de l’intendance de Bretagne (essai sur les relations de la Bretagne avec le pouvoir central)	Canal	Séverin	Séverin CANAL	Séverin Canal			1907	11-28	canal	1	1689	1789				8-1906-1910	Canal, Séverin	190702		1907			NC		1689-1789			bon état
ENCPOS_1907_03	La constitution communale d’Épinal sous la domination des évêques de Metz (983-1444)	La constitution communale d’Épinal sous la domination des évêques de Metz (983-1444)	Chevreux	Charles	Charles CHEVREUX	Charles Chevreux			1907	29-36	chevreux	1	983	1444				8-1906-1910	Chevreux, Charles	190703		1907			NC		983-1444			bon état
ENCPOS_1907_04	Étude sur Henry_Arnauld dans ses rapports sur le Jansénisme	Étude sur Henry Arnauld dans ses rapports sur le Jansénisme. Précédé d'une courte esquisse biographique	Cochin	Claude	Claude COCHIN	Claude Cochin			1907	37-50	cochin		1597	1692				8-1906-1910	Cochin, Claude	190704		1907			NC		1597-1692			bon état
ENCPOS_1907_05	Les actes de l’abbaye de Marmoutier jusque vers le milieu du <abbr>xii<sup>e</sup></abbr> siècle	Les actes de l’abbaye de Marmoutier jusque vers le milieu du xiie siècle	Colmant	Pierre	Pierre COLMANT	Pierre Colmant			1907	51-56	colmant	1	350	1150				8-1906-1910	Colmant, Pierre	190705		1907			NC		350-1150			bon état
ENCPOS_1907_06	L’abbaye de Saint-Médard de Soissons, des origines au <abbr>xiv<sup>e</sup></abbr> siècle	L’abbaye de Saint-Médard de Soissons, des origines au xive siècle	Dauverné	Jules	J. DAUVERNÉ	J. Dauverné			1907	57-69	dauverne	1	485	1399				8-1906-1910	Dauverné, Jules	190706		1907			NC		485-1399			bon état
ENCPOS_1907_07	Essai sur la chronologie et la généalogie des comtes d’Angoulême, du milieu du <abbr>ix<sup>e</sup></abbr> siècle à la fin du <abbr>xi<sup>e</sup></abbr>	Essai sur la chronologie et la généalogie des comtes d’Angoulême du milieu du ixe à la fin du xie siècle 	Desages	Charles	Charles DESAGES	Charles Desages			1907	71-85	desages	1	850	1110				8-1906-1910	Desages, Charles	190708		1907			NC		850-1110			bon état
ENCPOS_1907_08	Étude sur les contestations de limites et les traités de neutralité entre la Franche-Comté et les terres françaises de Champagne et de Bourgogne jusqu’aux accords de 1612-1614	Étude sur les contestations de limites et les traités de neutralité entre la Franche-Comté et les terres françaises de Champagne et de Bourgogne jusqu’aux accords de 1612-1614	Destray	Paul	Paul DESTRAY	Paul Destray			1907	87-92	destray	1	1612	1614				8-1906-1910	Destray, Paul	190709		1907			NC		1612-1614			bon état
ENCPOS_1907_09	Essai sur les voies de recours devant l’Échiquier de Normandie au <abbr>xiv<sup>e</sup></abbr> siècle	Essai sur les voies de recours devant l’Échiquier de Normandie au xive siècle	Fréville De Lorme, De	Robert	Robert de FRÉVILLE DE LORME	Robert de Fréville de Lorme			1907	93-98	frevilledelorme	1	1300	1399				8-1906-1910	Fréville De Lorme, De, Robert	190710		1907			NC		1300-1399			bon état
ENCPOS_1907_10	Catalogue des actes des évêques de Langres, précédé d’une introduction historique et diplomatique du <abbr>vii<sup>e</sup></abbr> siècle à 1111	Catalogue des actes des évêques de Langres, précédé d’une introduction historique et diplomatique du viie siècle à 1111	Gautier	Pierre	Pierre GAUTIER	Pierre Gautier			1907	99-102	gautier	1	600	1111				8-1906-1910	Gautier, Pierre	190711		1907			NC		600-1111			bon état
ENCPOS_1907_11	Les paysans de Cluny	Les paysans de Cluny. Essai sur la condition de la classe agricole en Bourgogne du xe au xiiie siècle	Houdayer	Raymond	Raymond HOUDAYER	Raymond Houdayer			1907	103-107	houdayer	1	909	1199				8-1906-1910	Houdayer, Raymond	190712		1907			NC		909-1199			bon état
ENCPOS_1907_12	Études sur le comté du Maine (820-1110)	Études sur le comté du Maine (820-1110)	Latouche	Robert	Robert LATOUCHE	Robert Latouche			1907	109-115	latouche	1	820	1110				8-1906-1910	Latouche, Robert	190713		1907			NC		820-1110			bon état
ENCPOS_1907_13	Relations de Pierre_IV_le_Cérémonieux, roi d’Aragon, avec la France, de 1340 à 1380	Relations de Pierre IV leCérémonieux, roi d’Aragon, avec la France, de 1340 à 1380 d'après les archives de la courone d'Aragon	Maupassant, De	Jean	Jean de MAUPASSANT	Jean de Maupassant			1907	117-121	maupassant	1	1340	1380				8-1906-1910	Maupassant, De, Jean	190714		1907			NC		1340-1380			bon état
ENCPOS_1907_14	L’ambassade de Particelli_d_Héméry en Piémont (1636-1639)	L’ambassade de Particelli d'Héméry en Piémont (1636-1639)	Mun, De	Gabriel	Gabriel de MUN	Gabriel de Mun			1907	123-135	mun	1	1636	1639				8-1906-1910	Mun, De, Gabriel	190715		1907			NC		1636-1639			bon état
ENCPOS_1907_15	Amauri_II, vicomte de Narbonne (1260?-1328) : sa jeunesse et ses expéditions guerrières, son gouvernement, son administration	Amauri II, vicomte de Narbonne (1260?-1328) : sa jeunesse et ses expéditions guerrières, son gouvernement, son administration	Régné	Jean	Jean RÉGNÉ	Jean Régné			1907	137-151	regne	1	1260	1328				8-1906-1910	Régné, Jean	190716		1907			NC		1260-1328			bon état
ENCPOS_1907_16	L’organisation de l’hôtel du roi au <abbr>xiii<sup>e</sup></abbr> siècle et jusqu’en 1328	L’organisation de l’hôtel du roi au xiiie siècle et jusqu’en 1328 d'après les comptes et les ordonnances de l'hôtel	Ritter	Georges	Georges RITTER	Georges Ritter			1907	153-160	ritter	1	1200	1328				8-1906-1910	Ritter, Georges	190718		1907			NC		1200-1328			bon état
ENCPOS_1907_17	Bernard de la Sauvetat, abbé de Sahagun, archévêque de Tolède (vers 1040-1124), et la réforme clunisienne en Espagne au <abbr>xi<sup>e</sup></abbr> et au <abbr>xi<sup>e</sup></abbr> siècle	Bernard de la Sauvetat, abbé de Sahagun, archévêque de Tolède (vers 1040-1124), et la réforme clunisienne en Espagne au xie et au xii siècle	Robin	Marcel	Marcel ROBIN	Marcel Robin			1907	161-165	robin	1	1040	1124				8-1906-1910	Robin, Marcel	190719		1907			NC		1040-1124			bon état
ENCPOS_1907_18	La vie et les exploits d’Etienne_de_Vignolles, dit la Hire (1390?-1443)	La vie et les exploits d’Étienne de Vignolles, dit la Hire, capitaine gascon et bailli de Vermandois (1390?-1443)	Rohmer	Régis	Régis ROHMER	Régis Rohmer			1907	167-173	rohmer	1	1390	1443				8-1906-1910	Rohmer, Régis	190720		1907			NC		1390-1443			bon état
ENCPOS_1907_19	Essai historique et généalogique sur les comtes de Roucy (948-1212)	Essai historique et généalogique sur les comtes de Roucy (948-1212)	Roussen De Florival, De	Henri	Henri de ROUSSEN DE FLORIVAL	Henri de Roussen de Florival			1907	182	roussendeflorival	1	948	1212				8-1906-1910	Roussen De Florival, De, Henri	190721		1907			NC		948-1212			bon état
ENCPOS_1907_NEXT		pages postliminaires							1907	-183								8-1906-1910												
ENCPOS_1907_PREV		pages liminaires							1907	0								8-1906-1910												
ENCPOS_1908_01	Étude sur le mouvement politique de 1314	Étude sur le mouvement politique de 1314. Lapremière année du règne de Luois X	Artonne	André	André ARTONNE	André Artonne			1908	1-6	artonne	1	1314	1314				8-1906-1910	Artonne, André	190801		1908			NC		1314-1314			bon état
ENCPOS_1908_02	Formation et organisation du département de l’Allier	Formation et organisation du département de l’Allier	Berniawski	Louis	Louis BIERNAWSKI	Louis Biernawski			1908	7-18	berniawski	1	1789	1908				8-1906-1910	Berniawski, Louis	190802		1908			NC		1789-1908			bon état
ENCPOS_1908_03	Catalogue des actes de François_II, roi de France (10 juillet 1559-5 décembre 1560)	Catalogue des actes de François II, roi de France (10 juillet 1559-5 décembre 1560)	Bondois	Paul M.	Paul M. BONDOIS	Paul M. Bondois			1908	19-29	bondois	1	1559	1560				8-1906-1910	Bondois, Paul M.	190803		1908			NC		1559-1560			bon état
ENCPOS_1908_04	Catalogue des actes de Ponthieu (XI<sup>e</sup> siècle – 1279)	Catalogue des actes de Ponthieu (xie siècle–1279)	Brunel	Clovis	Clovis BRUNEL	Clovis Brunel			1908	31-35	brunel	1	1000	1279				8-1906-1910	Brunel, Clovis	190804		1908			NC		1000-1279			bon état
ENCPOS_1908_05	L’Hôtel royal des Invalides (1674-1789)	L’Hôtel royal des Invalides (1674-1789)	Burnand	Robert	Robert BURNAND	Robert Burnand			1908	37-48	burnand	1	1674	1789				8-1906-1910	Burnand, Robert	190805		1908			NC		1674-1789			bon état
ENCPOS_1908_06	Le Soissonnais de 1787 à 1790	Le Soissonnais de 1787 à 1790. L'assemblée provinciale, l'organisation départementale	Dupont	Henri	Henri DUPONT	Henri Dupont			1908	49-64	dupont	1	1787	1790				8-1906-1910	Dupont, Henri	190806		1908			NC		1787-1790			bon état
ENCPOS_1908_07	Étude sur les Eclogae et le Liber_officialis d’Amalaire précédées d’une notice biographique	Étude sur les Eclogae et le Liber officialis d’Amalaire précédées d’une notice biographique	Flicoteaux	Emmanuel	Emmanuel FLICOTEAUX	Emmanuel Flicoteaux			1908	65-71	flicoteaux	1	775	850				8-1906-1910	Flicoteaux, Emmanuel	190807		1908			NC		775-850			bon état
ENCPOS_1908_08	Essai sur la manufacture royale des glaces de France aux <abbr>xvii<sup>e</sup></abbr> et <abbr>xviii<sup>e</sup></abbr> siècle	Essai sur la manufacture royale des glaces de France aux xviie et xviiie siècle	Frémy	Elphège	Elphège FRÉMY	Elphège Frémy			1908	73-81	fremy		1600	1799				8-1906-1910	Frémy, Elphège	190808		1908			NC		1600-1799			bon état
ENCPOS_1908_09	La Provence au milieu du <abbr>xiii<sup>e</sup></abbr> siècle	La Provence au milieu du xiiie siècle, l'opposition nationale à Ramon Bérenguer IV et à Charles d'Anjou	Graziani	Paul	Paul GRAZIANI	Paul Graziani			1908	83-85	graziani	1	1220	1280				8-1906-1910	Graziani, Paul	190809		1908			NC		1220-1280			bon état
ENCPOS_1908_10	Le tribunal du clerc dans l’empire_romain et la Gaule mérovingienne jusqu’en 614	Le tribunal du clerc dans l’Empire romain et la Gaule mérovingienne jusqu’en 614	Lardé	Georges	Georges LARDÉ	Georges Lardé			1908	87-94	larde	1	-500	614				8-1906-1910	Lardé, Georges	190810		1908			NC		-500-614			bon état
ENCPOS_1908_11	Le langage parlé en Bourbonnais aux <abbr>xiii<sup>e</sup></abbr> et <abbr>xiv<sup>e</sup></abbr> siècles	Le langage parlé en Bourbonnais aux xiiie et xive siècles	Lavergne	Géraud	Géraud LAVERGNE	Géraud Lavergne			1908	95-99	lavergne	1	1200	1399				8-1906-1910	Lavergne, Géraud	190811		1908			NC		1200-1399			bon état
ENCPOS_1908_12	Jean_le_Bègue, greffier de la Chambre_des_comptes de Paris	Jean le Bègue, greffier de la Chambre des comptes de Paris	Martin	André	André MARTIN	André Martin			1908	101-103	martin	1	1368	1457				8-1906-1910	Martin, André	190812		1908			NC		1368-1457			bon état
ENCPOS_1908_13	Étude sur le marais de Bordeaux et de Bruges, de l’édit de 1599 à la Révolution	Étude sur le marais de Bordeaux et de Bruges, de l’édit de 1599 à la Révolution	Mathieu	Georges	Georges MATHIEU	Georges Mathieu			1908	105-109	mathieu	1	1599	1789				8-1906-1910	Mathieu, Georges	190813		1908			NC		1599-1789			bon état
ENCPOS_1908_14	Études sur la politique royale à l’égard de la noblesse et des villes consulaires dans la sénéchaussée de Beaucaire au temps de saint_Louis	Études sur la politique royale à l’égard de la noblesse et des villes consulaires dans la sénéchaussée de Beaucaire au temps de saint Louis	Michel	Robert	Robert MICHEL	Robert Michel			1908	111-122	michel	1	1226	1270				8-1906-1910	Michel, Robert	190814		1908			NC		1226-1270			bon état
ENCPOS_1908_15	Le sieur de Longlée, résident de France à Madrid et les relations officielles de la France et de l’Espagne de 1583 à 1589	Le sieur de Longlée, résident de France à Madrid et les relations officielles de la France et de l’Espagne de 1583 à 1589	Mousset	Albert	Albert MOUSSET	Albert Mousset			1908	123-131	mousset	1	1583	1589				8-1906-1910	Mousset, Albert	190815		1908			NC		1583-1589			bon état
ENCPOS_1908_16	La seigneurie de Montfort au diocèse de Chartres depuis l’origine jusqu’à la réunion au duché de Bretagne (X<sup>e</sup>-XIV<sup>e</sup> siècle)	La seigneurie de Montfort au diocèse de Chartres depuis l’origine jusqu’à la réunion au duché de Bretagne (xe-xive siècle)	Rhein	André	André RHEIN	André Rhein			1908	133-142	rhein	1	900	1399				8-1906-1910	Rhein, André	190816		1908			NC		900-1399			bon état
ENCPOS_1908_17	L’abbaye de Saint-Martin de Troarn au diocèse de Bayeux, des origines au <abbr>xvi<sup>e</sup></abbr> siècle	L’abbaye de Saint-Martin de Troarn au diocèse de Bayeux, des origines au xvie siècle	Sauvage	René-Norbert	R.-N. SAUVAGE	R.-N. Sauvage			1908	143-149	sauvage	1	500	1599				8-1906-1910	Sauvage, René-Norbert	190817		1908			NC		500-1599			bon état
ENCPOS_1908_18	Philippe_de_Crèvecoeur, seigneur d’Esquerdes, maréchal de France (1434?-1494), essai biographique	Philippe de Crèvecoeur, seigneur d’Esquerdes, maréchal de France (1434?-1494), essai biographique	Serpette De Bersaucourt	René	René SERPETTE de BERSAUCOURT	René Serpette de Bersaucourt			1908	151-157	serpettedebersaucourt	1	1434	1494				8-1906-1910	Serpette De Bersaucourt, René	190818		1908			NC		1434-1494			bon état
ENCPOS_1908_19	Études sur le commerce des grains dans la généralité de Rouen au <abbr>xviii<sup>e</sup></abbr> siècle	Études sur le commerce des grains dans la généralité de Rouen au xviiie siècle	Valmont	Gustave	Gustave VALMONT	Gustave Valmont			1908	159-173	valmont	1	1700	1799				8-1906-1910	Valmont, Gustave	190819		1908			NC		1700-1799			bon état
ENCPOS_1908_20	Une histoire inédite de la Ligue, œuvre d’un contemporain anonyme (1574-1593)	Une histoire inédite de la Ligue, œuvre d’un contemporain anonyme (1574-1593)	Valois	Charles	Charles VALOIS	Charles Valois			1908	175-188	valois	1	1574	1593				8-1906-1910	Valois, Charles	190820		1908			NC		1574-1593			bon état
ENCPOS_1908_NEXT		pages postliminaires							1908	-189								8-1906-1910												
ENCPOS_1908_PREV		pages liminaires							1908	0								8-1906-1910												
ENCPOS_1909_01	Compiègne depuis la fondation de Saint-Corneille jusqu’à l’abolition de la Commune (877-1319)	Compiègne depuis la fondation de Saint-Corneille jusqu’à l’abolition de la Commune (877-1319)	Béreux	Jean	Jean BÉREUX	Jean Béreux			1909	1-7	bereux	1	877	1319				8-1906-1910	Béreux, Jean	190901		1909			NC		877-1319			bon état
ENCPOS_1909_02	Études de diplomatique sur les notaires du Châtelet de Paris, avec un aperçu historique sur les origines du notariat français	Études de diplomatique sur les notaires du Châtelet de Paris, avec un aperçu historique sur les origines du notariat français	Boüard, De	Alain 	A. de BOÜARD	A. de Boüard			1909	9-16	bouard	1	1000	1909				8-1906-1910	Boüard, De, Alain 	190902		1909			NC		1000-1909			bon état
ENCPOS_1909_03	Étude sur l’Hôtel-Dieu d’Orléans au Moyen_Âge et au <abbr>xvi<sup>e</sup></abbr> siècle	Étude sur l’Hôtel-Dieu d’Orléans au Moyen Âge et au xvie siècle	Bouvier	Pierre	Pierre BOUVIER	Pierre Bouvier			1909	17-25	bouvier	1	1000	1599				8-1906-1910	Bouvier, Pierre	190903		1909			NC		1000-1599			bon état
ENCPOS_1909_04	Le gouvernement du maréchal de Matignon en Guyenne pendant l’interrègne (1589-1594)	Le gouvernement du maréchal de Matignon en Guyenne pendant l’interrègne (1589-1594)	Gebelin	François	F. GEBELIN	F. Gebelin			1909	27-34	gebelin	1	1589	1594				8-1906-1910	Gebelin, François	190904		1909			NC		1589-1594			bon état
ENCPOS_1909_05	Maillebois et l’insurrection corse (1739-1742)	Maillebois et l’insurrection corse (1739-1742)	Graziani	Paul	Paul GRAZIANI,	Paul Graziani,			1909	35-39	graziani	1	1739	1742				8-1906-1910	Graziani, Paul	190905		1909			NC		1739-1742			bon état
ENCPOS_1909_06	L’école gothique religieuse du midi de la France	L’école gothique religieuse du midi de la France	Guitard	Eugène	Eugène GUITARD.	Eugène Guitard.			1909	41-45	guitard	1	1100	1399				8-1906-1910	Guitard, Eugène	190906		1909			NC		1100-1399			bon état
ENCPOS_1909_07	Essai sur le Béarn sous l’administration de l’intendant d’Étigny (1751-1767)	Essai sur le Béarn sous l’administration de l’intendant d’Étigny (1751-1767)	Lafond	Jean	Jean LAFOND	Jean Lafond			1909	47-56	lafond	1	1751	1767				8-1906-1910	Lafond, Jean	190907		1909			NC		1751-1767			bon état
ENCPOS_1909_08	Charles_le_Masle, évêque constitutionnel du département du Morbihan	Charles le Masle, évêque constitutionnel du département du Morbihan	Lanco	Pascal	Pascal LANCO,	Pascal Lanco,			1909	57-62	lanco	1	1791	1793				8-1906-1910	Lanco, Pascal	190908		1909			NC		1791-1793			bon état
ENCPOS_1909_09	Le tribunal_des_maréchaux_de_France	Le tribunal des maréchaux de France	Le Barrois D’orgeval	Gabriel	Gabriel LE BARROIS D’ORGEVAL,	Gabriel Le Barrois d’Orgeval,			1909	63-78	lebarroisdorgeval	1	1650	1789				8-1906-1910	Le Barrois D’orgeval, Gabriel	190909		1909			NC		1650-1789			bon état
ENCPOS_1909_10	Étude sur la Bouquechardière de Jean_de_Courcy	Étude sur la Bouquechardière de Jean de Courcy	Lécureux	Lucien	Lucien LÉGUREUX,	Lucien Légureux,			1909	79-86	lecureux	1	1340	1396				8-1906-1910	Lécureux, Lucien	190910		1909			NC		1340-1396			bon état
ENCPOS_1909_11	Essai sur la chronique de Morée, édition de la version française précédée d’une introduction historique et philologique sur les diverses versions de cette chronique	Essai sur la chronique de Morée, édition de la version française précédée d’une introduction historique et philologique sur les diverses versions de cette chronique	Longnon	Jean	Jean LONGNON,	Jean Longnon,			1909	87-94	longnon	1	1095	1333				8-1906-1910	Longnon, Jean	190911		1909			NC		1095-1333			bon état
ENCPOS_1909_12	Études sur le rôle politique, administratif et militaire de Jacques d’Albon_de_Saint-André (1512-1562)	Études sur le rôle politique, administratif et militaire de Jacques d’Albon de Saint-André (1512-1562)	Romier	Lucien	Lucien ROMIER,	Lucien Romier,			1909	95-105	romier	1	1512	1562				8-1906-1910	Romier, Lucien	190912		1909			NC		1512-1562			bon état
ENCPOS_1909_13	Étude biographique sur Eudes_de_Sully, évêque de Paris (1197-1208)	Étude biographique sur Eudes de Sully, évêque de Paris (1197-1208)	Rousset	Maurice	Maurice ROUSSET,	Maurice Rousset,			1909	107-113	rousset	1	1197	1208				8-1906-1910	Rousset, Maurice	190913		1909			NC		1197-1208			bon état
ENCPOS_1909_14	L’application de la Pragmatique_Sanction sous Charles_VII et Louis_XI au Chapitre de Paris	L’application de la Pragmatique Sanction sous Charles VII et Louis XI au Chapitre cathédral de Paris	Salvini	Joseph	Joseph SALVINI,	Joseph Salvini,			1909	115-120	salvini	1	1422	1483				8-1906-1910	Salvini, Joseph	190914		1909			NC		1422-1483			bon état
ENCPOS_1909_15	Le rôle politique du Cardinal_de_Bourbon (Charles_X)	Le rôle politique du Cardinal de Bourbon (Charles X)	Saulnier	Eugène	Eugène SAULNIER.	Eugène Saulnier.			1909	121-127	saulnier	1	1523	1590				8-1906-1910	Saulnier, Eugène	190915		1909			NC		1523-1590			bon état
ENCPOS_1909_NEXT		pages postliminaires							1909	-129								8-1906-1910												
ENCPOS_1909_PREV		pages liminaires							1909	0								8-1906-1910												
ENCPOS_1910_01	Études sur le commerce et l’industrie à Chartes, depuis le <abbr>xi<sup>e</sup></abbr> siècle jusqu’à la fin du ministère de Colbert	Études sur le commerce et l’industrie à Chartes, depuis le xie siècle jusqu’à la fin du ministère de Colbert	Aclocque	Geneviève	Geneviève ACLOCQUE	Geneviève Aclocque			1910	1-12	aclocque	2	1000	1683				8-1906-1910	Aclocque, Geneviève	191001		1910			NC		1000-1683			bon état
ENCPOS_1910_02	La moralité de Bien_Advisé_et_Mal_Advisé, précédée d’une étude sur les moralités en général	La moralité de Bien Advisé & Mal Advisé, précédée d’une étude sur les moralités en général	Babelon	Jean	Jean BABELON	Jean Babelon			1910	13-17	babelon	1	1300	1499				8-1906-1910	Babelon, Jean	191002		1910			NC		1300-1499			bon état
ENCPOS_1910_03	La viticulture en Bordelais au Moyen_Âge	La viticulture en Bordelais au Moyen Âge	Barennes	Jean	Jean BARENNES	Jean Barennes			1910	19-26	barennes	1	500	1499				8-1906-1910	Barennes, Jean	191003		1910			NC		500-1499			bon état
ENCPOS_1910_04	Les institutions municipales dans le Comté_Venaissin des origines à 1790	Les institutions municipales dans le Comté Venaissin des origines à 1790	Chobaut	Hyacinthe	H. CHOBAUT	H. Chobaut			1910	27-33	chobaut	1	500	1790				8-1906-1910	Chobaut, Hyacinthe	191004		1910			NC		500-1790			bon état
ENCPOS_1910_05	Étude archéologique sur la cathédrale de Troyes	Étude archéologique sur la cathédrale de Troyes	Chodron De Courcel	Valentin	Valentin CHODRON DE COURCEL	Valentin Chodron de Courcel			1910	35-44	chodrondecourcel	1	300	1700				8-1906-1910	Chodron De Courcel, Valentin	191005		1910			NC		300-1700			bon état
ENCPOS_1910_06	Les institutions municipales de Castres du <abbr>xii<sup>e</sup></abbr> au <abbr>xvi<sup>e</sup></abbr> siècle	Les institutions municipales de Castres du xiie au xvie siècle	Colombié	Joseph	J. COLOMBIÉ	J. Colombié			1910	45-51	colombie	1	1100	1599				8-1906-1910	Colombié, Joseph	191006		1910			NC		1100-1599			bon état
