id	title_rich	title_text	author_name	author_firstname	NomComplet	author_idref-id	promotion_year	pagination	author_gender	topic_notBefore	topic_notAfter	enc_teacher	these_biblionumber-benc	these_ppn-sudoc	ark_databnf	ark_cataloguebnf	id_wikidata	link_wikipedia	id_dbpedia
ENCPOS_1909_14	L’application de la Pragmatique Sanction sous Charles VII et Louis XI au Chapitre de Paris	L’application de la Pragmatique Sanction sous Charles VII et Louis XI au Chapitre cathédral de Paris	Salvini	Joseph	Joseph Salvini		1909	115-120	1	1422	1483								
ENCPOS_1909_15	Le rôle politique du Cardinal de Bourbon (Charles X)	Le rôle politique du Cardinal de Bourbon (Charles X)	Saulnier	Eugène	Eugène Saulnier	033802556	1909	121-127	1	1523	1590				http://data.bnf.fr/ark:/12148/cb13011396q	https://catalogue.bnf.fr/ark:/12148/cb13011396q	http://wikidata.org/entity/Q35110964		
ENCPOS_1909_NEXT		pages postliminaires					1909	-129											
ENCPOS_1909_PREV		pages liminaires					1909	0											
ENCPOS_1910_01	Études sur le commerce et l’industrie à Chartes, depuis le <small>XI</small><sup>e</sup> siècle jusqu’à la fin du ministère de Colbert	Études sur le commerce et l’industrie à Chartes, depuis le xie siècle jusqu’à la fin du ministère de Colbert	Aclocque	Geneviève	Geneviève Aclocque	02996072X	1910	1-12	2	1000	1683								
ENCPOS_1910_02	La moralité de Bien Advisé et Mal Advisé, précédée d’une étude sur les moralités en général	La moralité de Bien Advisé & Mal Advisé, précédée d’une étude sur les moralités en général	Babelon	Jean	Jean Babelon	031875505	1910	13-17	1	1300	1499				http://data.bnf.fr/ark:/12148/cb12300864d	https://catalogue.bnf.fr/ark:/12148/cb12300864d	http://wikidata.org/entity/Q3170484	http://fr.wikipedia.org/wiki/Jean_Babelon	http://dbpedia.org/resource/Jean_Babelon
ENCPOS_1910_03	La viticulture en Bordelais au Moyen Âge	La viticulture en Bordelais au Moyen Âge	Barennes	Jean	Jean Barennes	08157097X	1910	19-26	1	500	1499								
ENCPOS_1910_04	Les institutions municipales dans le Comté Venaissin des origines à 1790	Les institutions municipales dans le Comté Venaissin des origines à 1790	Chobaut	Hyacinthe	Hyacinthe Chobaut	033486646	1910	27-33	1	500	1790				http://data.bnf.fr/ark:/12148/cb124348091	https://catalogue.bnf.fr/ark:/12148/cb124348091	http://wikidata.org/entity/Q24205829	http://fr.wikipedia.org/wiki/Hyacinthe_Chobaut	
ENCPOS_1910_05	Étude archéologique sur la cathédrale de Troyes	Étude archéologique sur la cathédrale de Troyes	Chodron De Courcel	Valentin	Valentin Chodron De Courcel	254313213	1910	35-44	1	300	1700								
ENCPOS_1910_06	Les institutions municipales de Castres du <small>XII</small><sup>e</sup> au <small>XVI</small><sup>e</sup> siècle	Les institutions municipales de Castres du xiie au xvie siècle	Colombié	Joseph	Joseph Colombié	250562944	1910	45-51	1	1100	1599								
ENCPOS_1910_07	Étude sur la censive de Saint-Germain-l’Auxerrois, à Paris au <small>XIII</small><sup>e</sup> et au <small>XIV</small><sup>e</sup> siècle	Étude sur la censive de Saint-Germain-l’Auxerrois, à Paris au xiiie et au xive siècle	Deloncle	Pierre	Pierre Deloncle	074562010	1910	53-57	1	1200	1399				http://data.bnf.fr/ark:/12148/cb11056000s	https://catalogue.bnf.fr/ark:/12148/cb11056000s	http://wikidata.org/entity/Q35111790		
ENCPOS_1910_08	Formaiton et organisation du département du Cantal (1789-an III)	Formaiton et organisation du département du Cantal (1789-an III)	Faucher	Benjamin	Benjamin Faucher	03107748X	1910	59-64	1	1789	1796								
ENCPOS_1910_09	Contribution à l’étude de la jeunesse de Du Plessis-Mornay et de ses débuts dans la politique et la diplomatie (1549-1582) suivie de lettres inédites de Du Plessis-Mornay conservées à la Bibliothèque Nationale	Contribution à l’étude de la jeunesse de Du Plessis-Mornay et de ses débuts dans la politique et la diplomatie (1549-1582), suivie de lettres inédites de Du Plessis-Mornay conservées à la Bibliothèque nationale	Garric	Gabriel	Gabriel Garric	254313221	1910	65-71	1	1549	1582								
ENCPOS_1910_10	Essai historique sur le cimetière des Saints-Innocents, depuis les origines jusqu’à 1786	Essai historique sur le cimetière des Saints-Innocents, depuis les origines jusqu’à 1786	Gastineau	Marcel	Marcel Gastineau	122092171	1910	73-79	1	1000	1786				http://data.bnf.fr/ark:/12148/cb10717311r	https://catalogue.bnf.fr/ark:/12148/cb10717311r	http://wikidata.org/entity/Q35112405		
ENCPOS_1910_11	La congrégation de Montaigu (1490-1580)	La congrégation de Montaigu (1490-1580)	Godet	Marcel	Marcel Godet	033857970	1910	81-92	1	1490	1580				http://data.bnf.fr/ark:/12148/cb12467267w	https://catalogue.bnf.fr/ark:/12148/cb12467267w	http://wikidata.org/entity/Q35112677		
ENCPOS_1910_12	Les États d’Artois, depuis leur origine jusqu’à la réconciliation des provinces wallonnes avec Philippe II (1340-1579)	Les États d’Artois, depuis leur origine jusqu’à la réconciliation des provinces wallonnes avec Philippe II (1340-1579)	Hirschauer	Charles	Charles Hirschauer	033058326	1910	93-107	1	1340	1579				http://data.bnf.fr/ark:/12148/cb12396323r	https://catalogue.bnf.fr/ark:/12148/cb12396323r	http://wikidata.org/entity/Q35112989		
ENCPOS_1910_13	La Juridiction de la Municipalité parisienne de saint Louis à Charles VII	La Juridiction de la Municipalité parisienne de saint Louis à Charles VII	Huisman	Georges	Georges Huisman	028270584	1910	109-118	1	1226	1461				http://data.bnf.fr/ark:/12148/cb120141048	https://catalogue.bnf.fr/ark:/12148/cb120141048	http://wikidata.org/entity/Q830540	http://fr.wikipedia.org/wiki/Georges_Huisman	
ENCPOS_1910_14	Essai historique sur le Chapitre cathédral de Digne et sur Pierre Gassendi, chanoine et prévôt (1177-1790)	Essai historique sur le Chapitre cathédral de Digne et sur Pierre Gassendi, chanoine et prévôt (1177-1790)	Isnard	Émile	Émile Isnard	030270863	1910	119-124	1	1177	1790				http://data.bnf.fr/ark:/12148/cb12172228g	https://catalogue.bnf.fr/ark:/12148/cb12172228g	http://wikidata.org/entity/Q35113319		
ENCPOS_1910_15	La Juridiction municipale à Toulouse au <small>XII</small><sup>e</sup> et au <small>XIII</small><sup>e</sup> siècle, étude de droit urbain et d’administration judiciaire	La Juridiction municipale à Toulouse au xiie et au xiiie siècle, étude de droit urbain et d’administration judiciaire	Loirette	Gabriel	Gabriel Loirette	081498373	1910	125-131	1	1100	1299				http://data.bnf.fr/ark:/12148/cb12711954h	https://catalogue.bnf.fr/ark:/12148/cb12711954h	http://wikidata.org/entity/Q35113581		
ENCPOS_1910_16	L’Ordre des Avocats au Parlement de Paris, aux <small>XVII</small><sup>e</sup> et au <small>XVII</small><sup>e</sup> siècles (1602-1790)	L’Ordre des Avocats au Parlement de Paris aux xviie et au xviii siècles (1602-1790)	Loncle	Maurice	Maurice Loncle	150082606	1910	133-141	1	1602	1790				http://data.bnf.fr/ark:/12148/cb11816554n	https://catalogue.bnf.fr/ark:/12148/cb11816554n	http://wikidata.org/entity/Q35113818		
ENCPOS_1910_17	Les réformes et les origines de la Ligue dans le Maine et principalement dans la ville du Mans	Les réformes et les origines de la Ligue dans le Maine et principalement dans la ville du Mans	Luzu	Roger	Roger Luzu	250819910	1910	143-146	1	1500	1699								
ENCPOS_1910_18	Essai sur la politique religieuse de Philippe II dans les Pays-Bas	Essai sur la politique religieuse de Philippe le Bon dans les Pays-Bas	Mazeran	Georges	Georges Mazeran	087213389	1910	147-151	1	1550	1599				http://data.bnf.fr/ark:/12148/cb104063871	https://catalogue.bnf.fr/ark:/12148/cb104063871	http://wikidata.org/entity/Q35114421		
ENCPOS_1910_19	Simon Arnauld de Pomponne avant son ministère (1618-1671), étude sur sa jeunesse, sa carrière administrative et diplomatique	Simon Arnauld de Pomponne avant son ministère (1618-1671), étude sur sa jeunesse, sa carrière administrative et diplomatique	Pichard Du Page	René	René Pichard Du Page	122909062	1910	153-161	1	1618	1671				http://data.bnf.fr/ark:/12148/cb127695055	https://catalogue.bnf.fr/ark:/12148/cb127695055	http://wikidata.org/entity/Q35114717		
ENCPOS_1910_20	Étude biographique sur Eudes de Sully, évêque de Paris (1197-1208)	Étude biographique sur Eudes de Sully, évêque de Paris (1197-1208)	Rousset	Maurice	Maurice Rousset	07915123X	1910	163-167	1	1197	1208								
ENCPOS_1910_21	L’abbaye de Montmajour-lez-Arles du <small>X</small><sup>e</sup> au <small>XV</small><sup>e</sup> siècle	L’abbaye de Montmajour-lez-Arles du xe au xve siècle	Royer	Louis	Louis Royer	25431323X	1910	169-177	1	900	1499								
ENCPOS_1910_22	Essai historique sur les origines et l’organisation de l’église Saint-Marcel de Paris (<small>V</small><sup>e</sup> siècle – 1597)	Essai historique sur les origines et l’organisation de l’église Saint-Marcel de Paris (ve siècle – 1597)	Ruinaut	Joseph	Joseph Ruinaut	254312535	1910	179-184	1	400	1597								
ENCPOS_1910_NEXT		pages postliminaires					1910	-185											
ENCPOS_1910_PREV		pages liminaires					1910	0											
ENCPOS_1911_01	Les États du duché de Bourgogne jusqu’en 1498	Les États du duché de Bourgogne jusqu’en 1498	Billioud	Joseph	Joseph Billioud	072317396	1911	1-15	1	1000	1498				http://data.bnf.fr/ark:/12148/cb11793315z	https://catalogue.bnf.fr/ark:/12148/cb11793315z	http://wikidata.org/entity/Q3184611	http://fr.wikipedia.org/wiki/Joseph_Billioud	http://dbpedia.org/resource/Joseph_Billioud
ENCPOS_1911_02	Essai historique sur l’abbaye royale de Saint-Martin de Laon, des origines à l’union à l’évêché	Essai historique sur l’abbaye royale de Saint-Martin de Laon, des origines à l’union à l’évêché	Biver	André	André Biver	20069295X	1911	17-26	1	500	1911								
ENCPOS_1911_03	Contribution à l’histoire de la législation hypothécaire sous l’Ancien Régime	Contribution à l’histoire de la législation hypothécaire sous l’Ancien Régime	Blum	Edgar	Edgar Blum	080650864	1911	27-36	1	1500	1789				http://data.bnf.fr/ark:/12148/cb113262545	https://catalogue.bnf.fr/ark:/12148/cb113262545	http://wikidata.org/entity/Q35115732		
ENCPOS_1911_04	La manufacture de draps fins Vanrobais au <small>XVII</small><sup>e</sup> et au <small>XVIII</small><sup>e</sup> siècle	La manufacture de draps fins Vanrobais au xviie et au xviiie siècle	Courtecuisse	Maximilien	Maximilien Courtecuisse	254313248	1911	37-42	1	1600	1799								
ENCPOS_1911_05	Essai sur les origines, l’histoire et l’organisation de l’administration des Eaux et Forêts dans le domaine royal jusqu’au <small>XVI</small><sup>e</sup> siècle	Essai sur les origines, l’histoire et l’organisation de l’administration des Eaux et Forêts dans le domaine royal jusqu’au xvie siècle	Decq	Édouard	Édouard Decq	223398330	1911	43-48	1	500	1599								
ENCPOS_1911_06	Étude sur l’histoire et l’organisation de l’abbaye de Sainte-Colombe de Sens, depuis son origine jusqu’à la fin du <small>XV</small><sup>e</sup> siècle	Étude sur l’histoire et l’organisation de l’abbaye de Sainte-Colombe de Sens, depuis son origine jusqu’à la fin du xve siècle	Deschamps	Paul	Paul Deschamps	026826747	1911	49-57	1	620	1499				http://data.bnf.fr/ark:/12148/cb11002239c	https://catalogue.bnf.fr/ark:/12148/cb11002239c	http://wikidata.org/entity/Q3371051	http://fr.wikipedia.org/wiki/Paul_Deschamps	
ENCPOS_1911_07	Guillaume Gouffier, seigneur de Bonnivet, amiral de France (1485-1525)	Guillaume Gouffier, seigneur de Bonnivet, amiral de France (1485-1525)	Despras	Pierre	Pierre Despras	057255946	1911	59-65	1	1485	1525				http://data.bnf.fr/ark:/12148/cb14654081k	https://catalogue.bnf.fr/ark:/12148/cb14654081k	http://wikidata.org/entity/Q35117377		
ENCPOS_1911_08	L’Hôpital général des pauvres de Paris, aux <small>XVII</small><sup>e</sup> et <small>XVIII</small><sup>e</sup> siècles	L’Hôpital général des pauvres de Paris aux xviie et xviiie siècles	Estienne	Joseph	Joseph Estienne	034928057	1911	67-70	1	1600	1799				http://data.bnf.fr/ark:/12148/cb12562868v	https://catalogue.bnf.fr/ark:/12148/cb12562868v	http://wikidata.org/entity/Q35117704		
ENCPOS_1911_09	Étude sur l’administration d’Alfonse de Poitiers dans la Terre d’Auvergne	Étude sur l’administration d’Alfonse de Poitiers dans la Terre d’Auvergne	Fournier	Pierre	Pierre Fournier		1911	71-78	1	1220	1271								
ENCPOS_1911_10	Essai archéologique et artistique sur l’abbaye Saint-Victor de Paris	Essai archéologique et artistique sur l’abbaye Saint-Victor de Paris	Lemoine	Henri	Henri Lemoine	075976234	1911	79-84	1	1100	1790				http://data.bnf.fr/ark:/12148/cb12166540x	https://catalogue.bnf.fr/ark:/12148/cb12166540x	http://wikidata.org/entity/Q42575261		
ENCPOS_1911_11	Essai sur la Réforme et la Ligue dans le Maine jusqu’au 2 décembre 1589	Essai sur la Réforme et la Ligue dans le Maine jusqu’au 2 décembre 1589	Luzu	Roger	Roger Luzu	250819910	1911	85-93	1	1500	1589								
ENCPOS_1911_12	Essai sur la politique religieuse de Philippe le Bon dans les Pays-Bas	Essai sur la politique religieuse de Philippe le Bon dans les Pays-Bas	Mazeran	Georges	Georges Mazeran	087213389	1911	95-98	1	1419	1467				http://data.bnf.fr/ark:/12148/cb104063871	https://catalogue.bnf.fr/ark:/12148/cb104063871	http://wikidata.org/entity/Q35114421		
ENCPOS_1911_13	Prêteurs et emprunteurs d’argent à Paris sous François I<sup>er</sup>	Prêteurs et emprunteurs d’argent à Paris sous François Ier	Papinot	André	André Papinot	254313256	1911	99-105	1	1515	1547								
ENCPOS_1911_14	Histoire du district d’Ancenis (1788-1800)	Histoire du district d’Ancenis (1788-1800)	Perrier	Paul	Paul Perrier		1911	107-115	1	1788	1800								
ENCPOS_1911_15	Un essai de réforme de la taille au <small>XVIII</small><sup>e</sup> siècle dans la généralité de Limoges	Un essai de réforme de la taille au xviiie siècle dans la généralité de Limoges	Peyrichou	Léon	Léon Peyrichou	254313264	1911	117-121	1	1700	1799								
ENCPOS_1911_16	Les chartes de l’ordre dauphinois et provençal de Chalais	Les chartes de l’ordre dauphinois et provençal de Chalais	Roman	Joseph-Charles	Joseph-Charles Roman		1911	123-130	1	1101	1300								
ENCPOS_1911_17	Les voyages de l’abbé Carré, agent de Colbert en Orient (1666-1674)	Les voyages de l’abbé Carré, agent de Colbert en Orient (1666-1674)	Servant	Georges	Georges Servant	254323359	1911	131-135	1	1666	1674								
ENCPOS_1911_18	La cathédrale de Bayeux. Étude archéologique	La cathédrale de Bayeux. Étude archéologique	Vallery-Radot	Jean	Jean Vallery-Radot	031849911	1911	137-145	1	1000	1911				http://data.bnf.fr/ark:/12148/cb12298860n	https://catalogue.bnf.fr/ark:/12148/cb12298860n	http://wikidata.org/entity/Q3174936	http://fr.wikipedia.org/wiki/Jean_Vallery-Radot	
ENCPOS_1911_19	La Grande Confrérie Notre-Dame aux prêtres et aux bourgeois de Paris	La Grande Confrérie Notre-Dame aux prêtres et aux bourgeois de Paris	Vaquier	André	André Vaquier	034419578	1911	147-153	1	1000	1799				http://data.bnf.fr/ark:/12148/cb12517705v	https://catalogue.bnf.fr/ark:/12148/cb12517705v	http://wikidata.org/entity/Q15970936	http://fr.wikipedia.org/wiki/Andr%C3%A9_Vaquier	
ENCPOS_1911_20	Essai sur l’organisation et l’histoire administratives d’un bailliage royal aux <small>XIII</small><sup>e</sup> et <small>XIV</small><sup>e</sup> siècles. Le bailliage de Vermandois	Essai sur l’organisation et l’histoire administratives d’un bailliage royal aux xiiie et xive siècles. Le bailliage de Vermandois	Waquet	Henri	Henri Waquet	027192806	1911	155-164	1	1200	1399				http://data.bnf.fr/ark:/12148/cb11928880w	https://catalogue.bnf.fr/ark:/12148/cb11928880w	http://wikidata.org/entity/Q15407466	http://fr.wikipedia.org/wiki/Henri_Waquet	
ENCPOS_1911_NEXT		pages postliminaires					1911	-165											
ENCPOS_1911_PREV		pages liminaires					1911	0											
ENCPOS_1912_01	Le cardinal Pierre de Foix, le Vieux (1386-1464) et ses légations	Le cardinal Pierre de Foix, le Vieux (1386-1464) et ses légations	Baron	François	François Baron		1912	1-8	1	1386	1464								
ENCPOS_1912_02	L’abbaye royale de Saint-Martin de Laon	L’abbaye royale de Saint-Martin de Laon : des origines à l'union à l'évêché	Biver	André	André Biver	20069295X	1912	9-15	1	500	1789								
ENCPOS_1912_03	La cathédrale de Toul. Essai archéologique	La cathédrale de Toul. Essai archéologique	Boucher	François	François Boucher	030732476	1912	17-24	1	500	1799				http://data.bnf.fr/ark:/12148/cb122089513	https://catalogue.bnf.fr/ark:/12148/cb122089513	http://wikidata.org/entity/Q26271918		http://dbpedia.org/resource/Francois_Boucher_(art_historian)
ENCPOS_1912_04	Charles II, duc de Lorraine (1390-1431). Ses relations politiques avec la France et l’Empire de 1390 au 24 octobre 1420	Charles II, duc de Lorraine (1390-1431). Ses relations politiques avec la France et l’Empire de 1390 au 24 octobre 1420	Girod	Eugène	Eugène Girod	184121299	1912	25-32	1	1390	1420				http://data.bnf.fr/ark:/12148/cb16954583f	https://catalogue.bnf.fr/ark:/12148/cb16954583f			
ENCPOS_1912_05	Henri de Valois, duc d’Anjou (1551-1573)	Henri de Valois, duc d’Anjou (1551-1573)	Hellouin De Cenival	Pierre	Pierre Hellouin De Cenival	254313280	1912	33-37	1	1551	1573								
ENCPOS_1912_06	Le Comte d’Anjou, roman d’aventures du <small>XIV</small><sup>e</sup> siècle	Le Comte d’Anjou, roman d’aventures du xiv siècle par Jean Maillart. Essai d'établissement d'un texte critique, avec une introduction, un glossaire et une table des noms propres et des principaux personnages	Jablonski	Jean	Jean Jablonski	231358245	1912	39-42	1	1300	1399								
ENCPOS_1912_07	Étude sur la Chambre des comptes d’Angers (1360?-1483)	Étude sur la Chambre des comptes d'Angers (1360?-1483)	Jouanne	René	René Jouanne	033798192	1912	43-50	1	1360	1483				http://data.bnf.fr/ark:/12148/cb12462280w	https://catalogue.bnf.fr/ark:/12148/cb12462280w	http://wikidata.org/entity/Q35122767		
ENCPOS_1912_08	Louis de Gonzague, prince de Mantoue, duc de Nevers (1539-1595). Sa vie et ses écrits jusqu’en 1590	Louis de Gonzague, prince de Mantoue, duc de Nevers (1539-1595). Sa vie et ses écrits jusqu’en 1590	Loew	Jean	Jean Loew		1912	51-58	1	1539	1590								
ENCPOS_1912_09	L’Inquisition en Dauphiné du <small>XIV</small><sup>e</sup> siècle au début du règne de François I<sup>er</sup>	L’Inquisition en Dauphiné du xive siècle au début du règne de François Ier. Étude sur le développement et la répression de l'hérésie et de la sorcellerie	Marx	Jean	Jean Marx	027014568	1912	59-70	1	1300	1520				http://data.bnf.fr/ark:/12148/cb119149324	https://catalogue.bnf.fr/ark:/12148/cb119149324	http://wikidata.org/entity/Q35123464		
ENCPOS_1912_10	Les travaux publics de la ville de Périgueux au <small>XIV</small><sup>e</sup> siècle	Les travaux publics de la ville de Périgueux au xive siècle	Oudot De Dainville	Maurice	Maurice Oudot De Dainville	026809370	1912	71-74	1	1300	1399				http://data.bnf.fr/ark:/12148/cb118984566	https://catalogue.bnf.fr/ark:/12148/cb118984566	http://wikidata.org/entity/Q19266265	http://fr.wikipedia.org/wiki/Maurice_Oudot_de_Dainville	
ENCPOS_1912_11	Étude historique sur la rivière de Maine ou Mayenne	Étude historique sur la rivière de Maine ou Mayenne	Roussier	Paul	Paul Roussier	050144022	1912	75-81	1	-500	1900				http://data.bnf.fr/ark:/12148/cb130157614	https://catalogue.bnf.fr/ark:/12148/cb130157614	http://wikidata.org/entity/Q28867710		
ENCPOS_1912_12	Les compagnies de Saint-Christophe et des îles de l’Amérique (1626-1653)	Les compagnies de Saint-Christophe et des îles de l’Amérique (1626-1653)	Servant	Georges	Georges Servant	254323359	1912	83-88	1	1626	1653								
ENCPOS_1912_13	Essai archéologique sur l’église Saint-Séverin de Paris	Essai archéologique sur l’église Saint-Séverin de Paris	Verrier	Jean	Jean Verrier	031669115	1912	89-95	1	1000	1899				http://data.bnf.fr/ark:/12148/cb12284057c	https://catalogue.bnf.fr/ark:/12148/cb12284057c	http://wikidata.org/entity/Q35124041	http://fr.wikipedia.org/wiki/Jean_Verrier	
ENCPOS_1912_NEXT		pages postliminaires					1912	-97											
ENCPOS_1912_PREV		pages liminaires					1912	0											
ENCPOS_1913_01	La révocation de l ’édit de Nantes et le protestantisme au <small>XVIII</small><sup>e</sup> siècle en Bas-Poitou	La révocation de l ’édit de Nantes et le protestantisme au xviiie siècle en Bas-Poitou	Baudry	François	François Baudry		1913	1-7	1	1700	1799								
ENCPOS_1913_02	Étude historique et archéologique sur l’abbaye de Saint-Père de Chartres	Étude historique et archéologique sur l’abbaye de Saint-Père de Chartres	Berger	Eugène	Eugène Berger	250564343	1913	9-18	1	1000	1799								
ENCPOS_1913_03	Essai sur l’organisation et l’administration des Hôtels du Roi, de la Reine et du Dauphin sous Charles VI (1380-1422)	Essai sur l’organisation et l’administration des Hôtels du Roi, de la Reine et du Dauphin sous Charles VI (1380-1422)	Boucher	François	François Boucher	030732476	1913	19-26	1	1380	1422				http://data.bnf.fr/ark:/12148/cb122089513	https://catalogue.bnf.fr/ark:/12148/cb122089513	http://wikidata.org/entity/Q26271918		http://dbpedia.org/resource/Francois_Boucher_(art_historian)
ENCPOS_1913_04	Étude topographique sur la censive de Saint-Germain-l’Auxerrois à Paris (<small>XIII</small><sup>e</sup> siècle – 1740)	Étude topographique sur la censive de Saint-Germain-l’Auxerrois à Paris (xiiie siècle – 1740)	Deloncle	Pierre	Pierre Deloncle	074562010	1913	27-34	1	1200	1740				http://data.bnf.fr/ark:/12148/cb11056000s	https://catalogue.bnf.fr/ark:/12148/cb11056000s	http://wikidata.org/entity/Q35111790		
ENCPOS_1913_05	Claude d’Annebault, maréchal et amiral de France sous François I<sup>er</sup> et Henri II	Claude d’Annebault, maréchal et amiral de France sous François Ier et Henri II	Dermenghem	Émile	Émile Dermenghem	034091815	1913	35-40	1	1495	1552				http://data.bnf.fr/ark:/12148/cb12488330g	https://catalogue.bnf.fr/ark:/12148/cb12488330g	http://wikidata.org/entity/Q16222825	http://fr.wikipedia.org/wiki/%C3%89mile_Dermenghem	
ENCPOS_1913_06	Étude sur Michel Amelot et l’administration du commerce (1699-1724)	Étude sur Michel Amelot et l’administration du commerce (1699-1724)	Gaucheron	Roger	Roger Gaucheron	050440861	1913	41-49	1	1699	1724				http://data.bnf.fr/ark:/12148/cb135299982	https://catalogue.bnf.fr/ark:/12148/cb135299982	http://wikidata.org/entity/Q35128087		
ENCPOS_1913_07	Le recrutement des troupes réglées pendant la guerre de la Succession d’Espagne	Le recrutement des troupes réglées pendant la guerre de la Succession d'Espagne	Girard	Georges	Georges Girard		1913	51-55	1	1701	1714								
ENCPOS_1913_08	Étude sur les origines de la commune de Lyon (1173-1320)	Étude sur les origines de la commune de Lyon (1173-1320)	Guigue	Albert	Albert Guigue	098203924	1913	57-61	1	1173	1320								
ENCPOS_1913_09	Odet de Foix, vicomte de Lautrec (1483?-1528)	Odet de Foix, vicomte de Lautrec (1483?-16 août 1528)	La Cropte De Chanterac, De	Bertrand	Bertrand de La Cropte de Chanterac	244390029	1913	63-67	1	1483	1528								
ENCPOS_1913_10	Le droit privé dans les coutumes du Quercy aux <small>XIII</small><sup>e</sup> et aux <small>XIV</small><sup>e</sup> siècles	Le droit privé dans les coutumes du Quercy aux xiiie et aux xive siècles	Laval	Éloi	Éloi Laval	254313299	1913	69-76	1	1200	1399								
ENCPOS_1913_11	Le « Coustumier de Poictou » du <small>XV</small><sup>e</sup> siècle. Étude du texte et essai d’édition critique	Le « Coustumier de Poictou » du xve siècle. Étude du texte et essai d’édition critique	Lyon	Ernest	Ernest Lyon	081403437	1913	77-84	1	1400	1499				http://data.bnf.fr/ark:/12148/cb102462904	https://catalogue.bnf.fr/ark:/12148/cb102462904	http://wikidata.org/entity/Q35135564		
ENCPOS_1913_12	Étude sur l’abbaye de Cercamp (ordre de Cîteaux, diocèse d’Amiens)	Étude sur l’abbaye de Cercamp (ordre de Cîteaux, diocèse d’Amiens)	Macquart De Terline	Joseph	Joseph Macquart De Terline	174313098	1913	85-89	1	1000	1899								
ENCPOS_1913_13	Les censeurs royaux et l’approbation des livres (1623-1791)	Les censeurs royaux et l’approbation des livres (1623-1791)	Reizler	Stanislas	Stanislas Reizler	057102244	1913	91-98	1	1623	1791				http://data.bnf.fr/ark:/12148/cb12982943w	https://catalogue.bnf.fr/ark:/12148/cb12982943w	http://wikidata.org/entity/Q35135827		
ENCPOS_1913_14	La culture classique dans Raoul de Praelles, d’après sa traduction avec commentaire de la Cité de Dieu de saint Augustin	La culture classique dans Raoul de Praelles, d’après sa traduction avec commentaire de la Cité de Dieu de saint Augustin	Vallet	Henri	Henri Vallet		1913	99-102	1	1370	1380								
ENCPOS_1913_NEXT		pages postliminaires					1913	-103											
ENCPOS_1913_PREV		pages liminaires					1913	0											
ENCPOS_1914_01	Études historiques et archéologiques sur l’abbaye de la Chaise-Dieu (1043-1516)	Études historiques et archéologiques sur l’abbaye de la Chaise-Dieu (1043-1516)	Baubet	Victor	Victor Baubet	254312527	1914	5-10	1	1043	1516								
ENCPOS_1914_02	<i>Li livres d’Amours</i> de Drouart la Vache. Texte établi d’après le manuscrit unique de l’Arsenal, avec une introduction littéraire et philologique, un glossaire et une table des noms propres	« Li livres d'Amours » de Drouart la Vache. Texte établi d’après le manuscrit unique de l’Arsenal, avec une introduction littéraire et philologique, un glossaire et une table des noms propres	Bossuat	Robert	Robert Bossuat	026741040	1914	11-16	1	1290	1290				http://data.bnf.fr/ark:/12148/cb11893071s	https://catalogue.bnf.fr/ark:/12148/cb11893071s	http://wikidata.org/entity/Q1531112	http://fr.wikipedia.org/wiki/Robert_Bossuat	
