id	title_rich	title_text	author_name	author_firstname	NomComplet	author_idref-id	promotion_year	pagination	author_gender	topic_notBefore	topic_notAfter	enc_teacher	these_biblionumber-benc	these_ppn-sudoc	ark_databnf	ark_cataloguebnf	id_wikidata	link_wikipedia	id_dbpedia
ENCPOS_1957_11	Les actes de évêques d’Amiens jusqu’au début du <small>XIII</small><sup>e</sup> siècle	Les actes de évêques d’Amiens jusqu’au début du xiiie siècle	Lecoanet	Simone	Simone Lecoanet	111330092	1957	83-85	2	500	1250								
ENCPOS_1957_12	Pons le Provençal maître en <i>dictamen</i> (<small>XIII</small><sup>e</sup> siècle)	Pons le Provençal maître en « dictamen » (xiiie siècle)	Le Saulnier De Saint-Jouan	Henri-Georges	Henri-Georges Le Saulnier De Saint-Jouan		1957	87-92	1	1200	1299								
ENCPOS_1957_13	Recherches sur les noms de lieux du canton de Saint-Amant-de-Boixe (Charente)	Recherches sur les noms de lieux du canton de Saint-Amant-de-Boixe (Charente)	Mestayer	Monique	Monique Mestayer	027025357	1957	93-95	2	-500	1957				http://data.bnf.fr/ark:/12148/cb119157633	https://catalogue.bnf.fr/ark:/12148/cb119157633			
ENCPOS_1957_14	Le régime révolutionnaire à Châteauroux (1790-1795)	Le régime révolutionnaire à Châteauroux (1790-1795)	Nicot	Jean	Jean Nicot	02813625X	1957	97-104	1	1790	1795								
ENCPOS_1957_15	Arnaud de Villeneuve et la version provençale du <i>Rosarius philosophorum</i>	Arnaud de Villeneuve et la version provençale du « Rosarius philosophorum »	Payen	Jacques	Jacques Payen	027061426	1957	105-106	1	1238	1313				http://data.bnf.fr/ark:/12148/cb119188664	https://catalogue.bnf.fr/ark:/12148/cb119188664	http://wikidata.org/entity/Q36035296		
ENCPOS_1957_16	Les tanneries en France de 1730 à 1789 d’après les enquêtes administratives	Les tanneries en France de 1730 à 1789 d’après les enquêtes administratives	Pons	Henri	Henri Pons		1957	107-113	1	1730	1789								
ENCPOS_1957_17	L’administration de Saint-Domingue sous le gouvernement du comte d’Estaing (27 décembre 1763-8 juillet 1766)	L’administration de Saint-Domingue sous le gouvernement du comte d'Estaing (27 décembre 1763-8 juillet 1766)	Poussin	Brigitte	Brigitte Poussin	026957124	1957	115-121	2	1763	1766				http://data.bnf.fr/ark:/12148/cb11910363s	https://catalogue.bnf.fr/ark:/12148/cb11910363s	http://wikidata.org/entity/Q36036500		
ENCPOS_1957_18	Les domaines des ducs de Bretagne. Leur administration du <small>XIII</small><sup>e</sup> au <small>XV</small><sup>e</sup> siècle	Les domaines des ducs de Bretagne. Leur administration du xiiie au xve siècle	Renaudin	Yves	Yves Renaudin	137934343	1957	123-125	1	1200	1499								
ENCPOS_1957_NEXT		pages postliminaires					1957	-127											
ENCPOS_1957_PREV		pages liminaires					1957	0-10											
ENCPOS_1958_01	<i>Le roman de Ponthus et Sidoine</i> et la famille de la Tour-Landry	Le roman de « Ponthus et Sidoine » et la famille de la Tour-Landry	Boisard	Pierre	Pierre Boisard	153706732	1958	11-14	1	1370	1430				http://data.bnf.fr/ark:/12148/cb12110872w	https://catalogue.bnf.fr/ark:/12148/cb12110872w	http://wikidata.org/entity/Q3384053	http://fr.wikipedia.org/wiki/Pierre_Boisard	
ENCPOS_1958_02	Saint-Jean-d’Angély de 1372 à 1453. Son histoire. Ses institutions	Saint-Jean-d’Angély de 1372 à 1453. Son histoire. Ses institutions	Bonazzi	Élisabeth	Élisabeth Bonazzi	254314244	1958	15-20	2	1372	1453								
ENCPOS_1958_03	Le Parlement de Grenoble et la Réforme en Dauphiné du début du <small>XVI</small><sup>e</sup> siècle à 1575	Le Parlement de Grenoble et la Réforme en Dauphiné du début du xvie siècle à 1575	Courtieu	Jean	Jean Courtieu	026803054	1958	21-28	1	1500	1575				http://data.bnf.fr/ark:/12148/cb118979837	https://catalogue.bnf.fr/ark:/12148/cb118979837	http://wikidata.org/entity/Q36021062		
ENCPOS_1958_04	Recherches sur l’hippiatrie du <small>XIII</small><sup>e</sup> au <small>XV</small><sup>e</sup> siècle	Recherches sur l’hippiatrie du xiiie au xve siècle	Drieux	Yvonne	Yvonne Drieux	031405614	1958	29-34	2	1200	1499				http://data.bnf.fr/ark:/12148/cb12262596r	https://catalogue.bnf.fr/ark:/12148/cb12262596r	http://wikidata.org/entity/Q36022158		
ENCPOS_1958_05	Le temporel de l’abbaye de Saint-Médard de Soissons des origines au <small>XIII</small><sup>e</sup> siècle	Le temporel de l’abbaye de Saint-Médard de Soissons des origines au xiiie siècle	El-Helwa	Hassan	Hassan El-Helwa	254314252	1958	35-38	1	485	1299								
ENCPOS_1958_06	L’abbaye de Saint-Pierremont. Son histoire, ses archives, son cartulaire.	L’abbaye de Saint-Pierremont. Son histoire, ses archives, son cartulaire.	Engelmann	Monique	Monique Engelmann	254314260	1958	39-42	2	1096	1499								
ENCPOS_1958_07	Étude sur les frontières septentrionales et orientales du comté de Champagne (936-1284)	Étude sur les frontières septentrionales et orientales du comté de Champagne (936-1284)	Hubert	Marie-Clotilde	Marie-Clotilde Hubert	026926644	1958	43-49	2	936	1284				http://data.bnf.fr/ark:/12148/cb11907893k	https://catalogue.bnf.fr/ark:/12148/cb11907893k	http://wikidata.org/entity/Q36022646		
ENCPOS_1958_08	Les finances municipales de Dijon du milieu du <small>XIV</small><sup>e</sup> siècle à 1477	Les finances municipales de Dijon du milieu du xive siècle à 1477	Humbert	Françoise	Françoise Humbert	027203050	1958	51-58	2	1330	1477				http://data.bnf.fr/ark:/12148/cb119296274	https://catalogue.bnf.fr/ark:/12148/cb119296274	http://wikidata.org/entity/Q36023018		
ENCPOS_1958_09	Le rôle des traitants dans l’histoire et l’administration financières de la France de 1643 à 1653	Le rôle des traitants dans l’histoire et l’administration financières de la France de 1643 à 1653	Jacquard	Andrée	Andrée Jacquard	254314279	1958	59-66	1	1643	1653								
ENCPOS_1958_10	Un représentant de la polémique antimusulmane au <small>XV</small><sup>e</sup> siècle. Jean Germain, évêque de Nevers et de Châlon-sur-Saône (1400?-1461). Sa vie. Son œuvre	Un représentant de la polémique antimusulmane au xve siècle : Jean Germain, évêque de Nevers et de Châlon-sur-Saône (1400?-1461). Sa vie, son œuvre	Lacaze	Yvon	Yvon Lacaze	026958147	1958	67-75	1	1400	1461				http://data.bnf.fr/ark:/12148/cb11910456s	https://catalogue.bnf.fr/ark:/12148/cb11910456s	http://wikidata.org/entity/Q36024420		
ENCPOS_1958_11	Histoire des dépendances de l’abbaye de Saint-Germain-des-Prés, du début du <small>IX</small><sup>e</sup> siècle au milieu du <small>XII</small><sup>e</sup> siècle	Histoire des dépendances de l’abbaye de Saint-Germain-des-Prés, du début du ixe siècle au milieu du xiie siècle	La Motte-Collas, de	Marie	Marie de La Motte-Collas		1958	77-82	2	800	1199								
ENCPOS_1958_12	La seigneurie de Breuil du début du <small>XIV</small><sup>e</sup> siècle à 1621	La seigneurie de Breuil du début du xive siècle à 1621	Lanchier	Lucienne	Lucienne Lanchier	254314295	1958	83-86	2	1300	1621								
ENCPOS_1958_13	Étude du personnel de la chambre des comptes de Lille sous les ducs de Bourgogne	Étude du personnel de la chambre des comptes de Lille sous les ducs de Bourgogne	Leclercq	Francine	Francine Leclercq	052518515	1958	87-92	2	1369	1477				http://data.bnf.fr/ark:/12148/cb13560460n	https://catalogue.bnf.fr/ark:/12148/cb13560460n	http://wikidata.org/entity/Q36025705		
ENCPOS_1958_14	Matelots et soldats des vaisseaux du roi (département de Rochefort, 1691-1697)	Matelots et soldats des vaisseaux du roi (département de Rochefort, 1691-1697)	Martel, De	Marie-Thérèse	Marie-Thérèse de Martel	079408869	1958	93-101	2	1691	1697								
ENCPOS_1958_15	Recherches sur l’agriculture en Sologne au <small>XVIII</small><sup>e</sup> siècle	Recherches sur l’agriculture en Sologne au xviiie siècle	Orléans, D’	Jacques	Jacques D’Orléans	050723286	1958	103-107	1	1700	1799				http://data.bnf.fr/ark:/12148/cb135414745	https://catalogue.bnf.fr/ark:/12148/cb135414745	http://wikidata.org/entity/Q2420456	http://fr.wikipedia.org/wiki/Jacques_d%27Orl%C3%A9ans	http://dbpedia.org/resource/Prince_Jacques,_Duke_of_Orléans
ENCPOS_1958_16	Recherches sur le <i>Bonum universale de apibus</i> de Thomas de Cantimpré, suivies de l’édition des <i>exempla</i> d’après la traduction française faite pour Charles V en 1372	Recherches sur le  « Bonum universale de apibus » de Thomas de Cantimpré, suivies de l’édition des « exempla » d’après la traduction française faite pour Charles V en 1372	Palewska	Marie-Ange	Marie-Ange Palewska		1958	109-114	2	1372	1372								
ENCPOS_1958_17	Catalogues des actes de l’abbaye Saint-Jean-des-Vignes de Soissons depuis sa fondation (1076) jusqu’en 1267	Catalogues des actes de l’abbaye Saint-Jean-des-Vignes de Soissons depuis sa fondation (1076) jusqu’en 1267	Renaudin	Madeleine	Madeleine Renaudin		1958	115-118	2	1076	1267								
ENCPOS_1958_18	La seigneurie des archevêques-comtes de Tarentaise du <small>X</small><sup>e</sup> au <small>XVI</small><sup>e</sup> siècle	La seigneurie des archevêques-comtes de Tarentaise du xe au xvie siècle	Roubert	Jacqueline	Jacqueline Roubert	027110613	1958	119-126	2	900	1599				http://data.bnf.fr/ark:/12148/cb11922745n	https://catalogue.bnf.fr/ark:/12148/cb11922745n	http://wikidata.org/entity/Q36027864		
ENCPOS_1958_19	Recherches sur la geste de Nanteuil	Recherches sur la geste de Nanteuil	Turiaf	Florence	Florence Turiaf	254314309	1958	127-180	2	1000	1499								
ENCPOS_1958_20	Les scriptoria d’Angers au <small>XI</small><sup>e</sup> siècle	Les « scriptoria » d’Angers au xie siècle	Vezin	Jean	Jean Vezin		1958	181-138	1	1000	1099								
ENCPOS_1958_21	Recherches sur les représentations scéniques de la crèche et les chants de la Nativité en Ukraine au <small>XVIII</small><sup>e</sup> siècle et leur expansion	Recherches sur les représentations scéniques de la crèche et les chants de la Nativité en Ukraine au xviiie siècle et leur expansion	Vodoff	Wladimir	Wladimir Vodoff	02892049X	1958	139-145	1	1700	1799								
ENCPOS_1958_NEXT		pages postliminaires					1958	-147											
ENCPOS_1958_PREV		pages liminaires					1958	0-10											
ENCPOS_1959_01	Les soulèvements populaires dans le sud-ouest de la France sous le règne de Louis XIII	Les soulèvements populaires dans le sud-ouest de la France sous le règne de Louis_XIII	Bercé	Yves-Marie	Yves-Marie Bercé	026719703	1959	11-14	1	1610	1643				http://data.bnf.fr/ark:/12148/cb11891337z	https://catalogue.bnf.fr/ark:/12148/cb11891337z	http://wikidata.org/entity/Q3573413	http://fr.wikipedia.org/wiki/Yves-Marie_Berc%C3%A9	http://dbpedia.org/resource/Yves-Marie_Bercé
ENCPOS_1959_02	Recherches sur la technique de la banque pendant la deuxième moitié du <small>XVIII</small><sup>e</sup> siècle	Recherches sur la technique de la banque pendant la deuxième moitié du xviiie siècle	Brunerye	Marc	Marc Brunerye	254314317	1959	15-18	1	1750	1799								
ENCPOS_1959_03	Les livrets de prières privées du <small>IX</small><sup>e</sup> siècle	Les livrets de prières privées du ixe siècle : essai sur la théologie morale et la psychologie des fidèles	Chazelas	Jean	Jean Chazelas	029700418	1959	19-20	1	800	899				http://data.bnf.fr/ark:/12148/cb121268131	https://catalogue.bnf.fr/ark:/12148/cb121268131	http://wikidata.org/entity/Q36012389		
ENCPOS_1959_04	La vigne dans la partie méridionale de l’ancien diocèse de Lausanne au Moyen Âge	La vigne dans la partie méridionale de l’ancien diocèse de Lausanne au Moyen_Âge	Courtieu-Capt	Anne-Marie	Anne-Marie Courtieu-Capt	060860383	1959	21-24	2	500	1499				http://data.bnf.fr/ark:/12148/cb14401590t	https://catalogue.bnf.fr/ark:/12148/cb14401590t	http://wikidata.org/entity/Q36012752		
ENCPOS_1959_05	La vie économique et sociale dans la seigneurie de Delle sous l’administration de Mazarin (1658-1789)	La vie économique et sociale dans la seigneurie de Delle sous l’administration des Mazarin (1658-1789)	Daniel-Feltin	Chantal	Chantal Daniel-Feltin	254314325	1959	25-30	2	1658	1789								
ENCPOS_1959_06	Les possessions et les prieurés de l’abbaye de Marmoutier du <small>X</small><sup>e</sup> au <small>XIII</small><sup>e</sup> siècle	Les possessions et les prieurés de l’abbaye de Marmoutier du xe au xiiie siècle	Gantier	Odile	Odile Gantier	034886788	1959	31-37	2	900	1299				http://data.bnf.fr/ark:/12148/cb12559166q	https://catalogue.bnf.fr/ark:/12148/cb12559166q	http://wikidata.org/entity/Q36013750		
ENCPOS_1959_07	Le diocèse de Sens à la fin du Moyen Âge d’après les registres de visites	Le diocèse de Sens à la fin du Moyen Âge d’après les registres de visites	Gasnault-Beis	Marie-Claire	Marie-Claire Gasnault-Beis	074641883	1959	39-42	2	1200	1499				http://data.bnf.fr/ark:/12148/cb12461153g	https://catalogue.bnf.fr/ark:/12148/cb12461153g	http://wikidata.org/entity/Q36014279		
ENCPOS_1959_08	Catalogue des actes des évêques de Cambrai antérieurs à 1167	Catalogue des actes des évêques de Cambrai antérieurs à 1167	Hayez	Michel	Michel Hayez	026916762	1959	43-45	1	0	1167				http://data.bnf.fr/ark:/12148/cb119070596	https://catalogue.bnf.fr/ark:/12148/cb119070596	http://wikidata.org/entity/Q36014658		
ENCPOS_1959_09	Les recherches historiques en Gascogne au <small>XVIII</small><sup>e</sup> siècle : Jean-Baptiste Larcher et ses émules	Les recherches historiques en Gascogne au xviiie siècle : Jean-Baptiste Larcher et ses émules	Lafforgue	Annie	Annie Lafforgue	026959887	1959	47-49	2	1700	1799				http://data.bnf.fr/ark:/12148/cb11910599b	https://catalogue.bnf.fr/ark:/12148/cb11910599b	http://wikidata.org/entity/Q36009275		
ENCPOS_1959_10	<i>Arresta lata in Parlamento</i>, décisions notables du Parlement de Paris recueillies par un praticien anonyme entre 1371 et 1376	Arresta lata inParlamento décisions notables du Parlement de Paris recueillies par un praticien anonyme entre 1371 et 1376 : édition et étude	Naud	Gérard	Gérard Naud	02704503X	1959	51-59	1	1371	1376								
ENCPOS_1959_11	Le temporel de l’abbaye de Saint-Germain d’Auxerre des origines au milieu du <small>XIII</small><sup>e</sup> siècle	Le temporel de l’abbaye de Saint-Germain d'Auxerre des origines jusqu'au milieu du xiiie siècle	Parguez	Guy	Guy Parguez	027058131	1959	61-71	1	800	1280				http://data.bnf.fr/ark:/12148/cb119186041	https://catalogue.bnf.fr/ark:/12148/cb119186041	http://wikidata.org/entity/Q36014886		
ENCPOS_1959_12	Les généalogistes des ordres du roi au <small>XVIII</small><sup>e</sup> siècle	Les généalogistes des ordres du roi au xviiie siècle	Pathie	Françoise	Françoise Pathie	254314333	1959	73-78	2	1700	1799								
ENCPOS_1959_13	Les défenses militaires du Perche du <small>X</small><sup>e</sup> au <small>XIII</small><sup>e</sup> siècle	Les défenses militaires du Perche du xe au xiiie siècle	Siguret	Philippe	Philippe Siguret	02713797X	1959	79-84	1	900	1299								
ENCPOS_1959_NEXT		pages postliminaires					1959	-85											
ENCPOS_1959_PREV		pages liminaires					1959	0-10											
ENCPOS_1960_01	Étude sur l’œuvre de restauration financière de Sully, 1596-1610	Étude sur l’œuvre de restauration financière de Sully (1596-1610)	Barbiche	Bernard	Bernard Barbiche	026704358	1960	11-18	1	1596	1610	1			http://data.bnf.fr/ark:/12148/cb11890145s	https://catalogue.bnf.fr/ark:/12148/cb11890145s	http://wikidata.org/entity/Q2897484	http://fr.wikipedia.org/wiki/Bernard_Barbiche	
ENCPOS_1960_02	La confrérie Notre-Dame-de-l’Assomption et la vie paroissiale à Gisors de la fin du <small>XIV</small><sup>e</sup> siècle à la Révolution	La confrérie Notre-Dame-de-l’Assomption et la vie paroissiale à Gisors de la fin du xive siècle à la Révolution	Blanc	Marie-Annick	Marie-Annick Blanc		1960	19-24	2	1350	1789								
ENCPOS_1960_03	La légende des Rois Mages : édition de l’<i>Histoire des trois rois</i> avec une introduction historique	La légende des Rois Mages : introduction historique et édition de l’Histoire des trois rois	Elissagaray	Marie-Anne	Marie-Anne Elissagaray	254314341	1960	25-28	2	1150	1350								
ENCPOS_1960_04	La monnaie de Saint-Quentin au temps de Charles VI et de Charles VII (1385-vers 1447)	La monnaie de Saint-Quentin au temps de Charles VI et de Charles VII (1385-vers 1447)	Giard	Jean-Baptiste	Jean-Baptiste Giard	032483058	1960	29-33	1	1385	1447				http://data.bnf.fr/ark:/12148/cb123504394	https://catalogue.bnf.fr/ark:/12148/cb123504394	http://wikidata.org/entity/Q36007816		
ENCPOS_1960_05	Le temporel de l’abbaye de Fontevrault dans le Haut-Poitou des origines à la réforme du <small>XV</small><sup>e</sup> siècle	Le temporel de l’abbaye de Fontevrault dans le Haut-Poitou des origines à la réforme du xve siècle	Greleir	Françoise	Françoise Greleir	25431435X	1960	35-40	2	1101	1499								
ENCPOS_1960_06	Étude sur la forêt de Compiègne depuis la réformation de Colbert jusqu’à la Révolution	Étude sur la forêt de Compiègne depuis la réformation de Colbert jusqu’à la Révolution	Harlé-D’Ophove	Monique	Monique Harlé-D’Ophove	085466492	1960	41-47	2	1665	1789				http://data.bnf.fr/ark:/12148/cb12177706r	https://catalogue.bnf.fr/ark:/12148/cb12177706r			
ENCPOS_1960_07	Les pestes et les hôpitaux parisiens au <small>XVI</small><sup>e</sup> siècle	Les pestes et les hôpitaux parisiens au xvie siècle	Hohl	Claude	Claude Hohl	026923556	1960	49-52							http://data.bnf.fr/ark:/12148/cb11907643g	https://catalogue.bnf.fr/ark:/12148/cb11907643g	http://wikidata.org/entity/Q77441042		
ENCPOS_1960_08	Le commerce du bois de chauffage à Paris au <small>XVI</small><sup>e</sup> siècle avant le flottage	Le commerce du bois de chauffage à Paris au xvie siècle avant le flottage	Jullien-Charels	Claude	Claude Jullien-Charels	254314368	1960	53-61	2	1500	1599								
ENCPOS_1960_09	Jean-Baptiste Larcher, sa vie, son œuvre	Jean-Baptiste Larcher : sa vie, son œuvre	Laforgue	Annie	Annie Laforgue	254314376	1960	63-65	2	1600	1699								
ENCPOS_1960_10	Recherches sur les confréries de métiers à Rouen du <small>XIII</small><sup>e</sup> au <small>XV</small><sup>e</sup> siècle	Recherches sur les confréries de métiers à Rouen du xiiie au xve siècle	Lereboullet	Christiane	Christiane Lereboullet	254314384	1960	67-74	2	1200	1499								
ENCPOS_1960_11	Les comtes de Bourgogne de la maison de Souabe : contribution à l’histoire bourguignonne des Hohenstaufen	Les comtes de Bourgogne de la maison de Souabe : contribution à l’histoire bourguignonne  des Hohenstaufen	Mariotte	Jean-Yves	Jean-Yves Mariotte	027010473	1960	75-79	1	1156	1208				http://data.bnf.fr/ark:/12148/cb11914612p	https://catalogue.bnf.fr/ark:/12148/cb11914612p	http://wikidata.org/entity/Q3170182	http://fr.wikipedia.org/wiki/Jean-Yves_Mariotte	
ENCPOS_1960_12	Le « sel du Rhône » au Moyen Âge	Le « sel du Rhône » au Moyen Âge	Moulinier	Pierre	Pierre Moulinier		1960	81-84	1	500	1499								
ENCPOS_1960_13	Le Grand Conseil de Charles VIII à François I<sup>er</sup> (1483-1547)	Le Grand_Conseil de Charles VIII à François Ier (1483-1547)	Pelletier	Monique	Monique Pelletier		1960	85-90	2	1483	1547								
ENCPOS_1960_14	Étude sur l’histoire économique et sociale d’Ajaccio aux <small>XVI</small><sup>e</sup> et <small>XVII</small><sup>e</sup> siècles	Étude sur l’histoire économique et sociale d’Ajaccio aux xvie et xviie siècles	Pinzuti	Noël	Noël Pinzuti	067027377	1960	91-95	1	1500	1699				http://data.bnf.fr/ark:/12148/cb11919891k	https://catalogue.bnf.fr/ark:/12148/cb11919891k	http://wikidata.org/entity/Q36010058		
ENCPOS_1960_15	Saint-Pierre-et-Miquelon et la rivalité franco-anglaise à Terre-Neuve au <small>XVIII</small><sup>e</sup> siècle	Saint-Pierre-et-Miquelon et la rivalité franco-anglaise à Terre-Neuve au xviiie siècle	Ribault	Jean-Yves	Jean-Yves Ribault	027097757	1960	97-102	1	1700	1799				http://data.bnf.fr/ark:/12148/cb119217818	https://catalogue.bnf.fr/ark:/12148/cb119217818	http://wikidata.org/entity/Q36010458		
ENCPOS_1960_16	Histoire des dépendances de l’abbaye de Saint-Bertin du <small>VII</small><sup>e</sup> à la fin du <small>X</small><sup>e</sup> siècle	Histoire des dépendances de l’abbaye de Saint-Bertin du viie à la fin du xe siècle	Waksman	Bernard	Bernard Waksman	197762565	1960	103-106	1	600	999								
ENCPOS_1960_17	Les routes en Haute-Alsace à la fin de Moyen Âge	Les routes en Haute-Alsace à la fin de Moyen_Âge	Zundel	Anne	Anne Zundel	028174453	1960	107-114	2	1200	1499				http://data.bnf.fr/ark:/12148/cb12006258r	https://catalogue.bnf.fr/ark:/12148/cb12006258r	http://wikidata.org/entity/Q36011337		
ENCPOS_1960_NEXT		pages postliminaires					1960	-115											
ENCPOS_1960_PREV		pages liminaires					1960	0-10											
ENCPOS_1961_01	Les châteaux du Berry du <small>X</small><sup>e</sup> au <small>XIV</small><sup>e</sup> siècle	Les châteaux du Berry du xe au xive siècle	Chapu	Philippe	Philippe Chapu	029268788	1961	9-15	1	900	1399		125240	234765798	http://data.bnf.fr/ark:/12148/cb12093173h	https://catalogue.bnf.fr/ark:/12148/cb12093173h	http://wikidata.org/entity/Q35997120		
ENCPOS_1961_02	L’histoire sociale de la Martinique de 1635 à 1715	L’histoire sociale de la Martinique de 1635 à 1715	Chauleau	Liliane	Liliane Chauleau	026782707	1961	17-21	2	1635	1715		125242	234766654	http://data.bnf.fr/ark:/12148/cb11896372p	https://catalogue.bnf.fr/ark:/12148/cb11896372p	http://wikidata.org/entity/Q35997314		
ENCPOS_1961_03	La vie rurale en Revermont du milieu du <small>XIV</small><sup>e</sup> siècle à la fin du <small>XV</small><sup>e</sup> siècle	La vie rurale en Revermont du milieu du xive siècle à la fin du xve siècle	Cotton	Françoise	Françoise Cotton	115138056	1961	23-28	2	1300	1499								
ENCPOS_1961_04	Recherches su Jean-Baptiste Lully (1632-1687) et sur les débuts de l’Académie royale de musique	Recherches su Jean-Baptiste Lully (1632-1687) et sur les débuts de l’Académie royale de musique	Ducrot	Ariane	Ariane Ducrot	090870786	1961	29-32	2	1632	1687								
ENCPOS_1961_05	L’industrie papetière en France au <small>XVIII</small><sup>e</sup> siècle : étude économique d’après les archives du Contrôle général des finances et des Intendances	L’industrie papetière en France au xviiie siècle : étude économique d’après les archives du Contrôle général des finances et des Intendances	Gambier	Alix	Alix Gambier	02936115X	1961	33-36		1700	1799		125281	234775351					
ENCPOS_1961_06	L’écriture des actes de Louis VI, Louis VII et Philippe-Auguste	L’écriture des actes de Louis VI, Louis VII et Philippe-Auguste	Gasparri	Françoise	Françoise Gasparri	028735676	1961	37-40	2	1108	1223		125282	234776765	http://data.bnf.fr/ark:/12148/cb12051044b	https://catalogue.bnf.fr/ark:/12148/cb12051044b	http://wikidata.org/entity/Q35998310		
ENCPOS_1961_07	L’industrie du sel en Lorraine du <small>IX</small><sup>e</sup> siècle au début du <small>XVII</small><sup>e</sup> siècle	L’industrie du sel en Lorraine du ixe siècle au début du xviie siècle	Hiegel	Charles	Charles Hiegel	234778679	1961	41-48	1	800	1699		125283	234777087					
ENCPOS_1961_08	L’enseignement grammatical de Remi d’Auxerre	L’enseignement grammatical de Remi d’Auxerre	Jeudy	Colette	Colette Jeudy	026938189	1961	49-51	2	850	908		125284	234779780	http://data.bnf.fr/ark:/12148/cb11908819d	https://catalogue.bnf.fr/ark:/12148/cb11908819d	http://wikidata.org/entity/Q36000547		
ENCPOS_1961_09	Évolution politique et sociale de la ville de Nîmes de la fin du <small>XIII</small><sup>e</sup> siècle à la fin du <small>XIII</small><sup>e</sup> siècle (1272-1390)	Évolution politique et sociale de la ville de Nîmes de la fin du xiiie siècle à la fin du xive siècle (1272-1390)	Lafon	Marie-Antoinette	Marie-Antoinette Lafon	234783842	1961	53-58	2	1272	1390		125285	234783982					
ENCPOS_1961_10	Le commerce du vin à Paris au <small>XVI</small><sup>e</sup> siècle (1515-1577)	Le commerce du vin à Paris au xvie siècle (1515-1577)	Michel-Mulliez	Marie-Edmée	Marie-Edmée Michel-Mulliez	077845218	1961	59-65	2	1515	1577				http://data.bnf.fr/ark:/12148/cb12625620c	https://catalogue.bnf.fr/ark:/12148/cb12625620c	http://wikidata.org/entity/Q36001410		
ENCPOS_1961_11	Les éditions de Sophocle en Europe occidentale au <small>XVI</small><sup>e</sup> siècle	Les éditions de Sophocle en Europe occidentale au xvie siècle (1502-1603)	Parichet	Jacques	Jacques Parichet	027058158	1961	67-70	1	1502	1603				http://data.bnf.fr/ark:/12148/cb11918606q	https://catalogue.bnf.fr/ark:/12148/cb11918606q	http://wikidata.org/entity/Q36003076		
ENCPOS_1961_12	La grande entreprise privilégiée sous Colbert	La grande entreprise privilégiée sous Colbert	Pauly-Charreyre	Elisabeth	Elisabeth Pauly-Charreyre	234938986	1961	71-75	2	1665	1683		125392	234938684					
ENCPOS_1961_13	La vie municipale à Colmar aux <small>XIII</small><sup>e</sup> et <small>XIV</small><sup>e</sup> siècles	La vie municipale à Colmar aux xiiie et xive siècles	Playoust	Pierre-Yves	Pierre-Yves Playoust	02707630X	1961	77-81	1	1200	1399		125393	234939419					
ENCPOS_1961_14	Le <i>Liber thesauri occulti</i> de Pascalis Romanus, traité d’interprétation des songes du <small>XII</small><sup>e</sup> siècle	Le Liber thesauri occulti de Pascalis Romanus, traité d’interprétation des songes du xiie siècle	Roset	Simone	Simone Roset	030075599	1961	83-87	2	1100	1199		125394	234940123	http://data.bnf.fr/ark:/12148/cb12156474r	https://catalogue.bnf.fr/ark:/12148/cb12156474r	http://wikidata.org/entity/Q36005956		
ENCPOS_1961_15	Les jubés des églises de Bretagne	Les jubés des églises de Bretagne	Rouault	Madeleine	Madeleine Rouault	234767499	1961	89-92	2	1000	1499		125400	234944552					
