id	title_rich	title_text	author_name	author_firstname	NomComplet	author_idref-id	promotion_year	pagination	author_gender	topic_notBefore	topic_notAfter	enc_teacher	these_biblionumber-benc	these_ppn-sudoc	ark_databnf	ark_cataloguebnf	id_wikidata	link_wikipedia	id_dbpedia
ENCPOS_1987_07	Recherches sur les palais épiscopaux en France au Moyen Âge (<small>XII</small><sup>e</sup>-<small>XIII</small><sup>e</sup> siècles), d’après divers exemples des provinces ecclésiastiques de Reims et de Sens	Recherches sur les palais épiscopaux en France au Moyen Âge (XIIe-XIIIe siècles), d’après divers exemples des provinces ecclésiastiques de Reims et de Sens	Crépin-Leblond	Thierry	Thierry Crépin-Leblond	030853079	1987	63-69	1	1100	1299	1	94063	149311427	http://data.bnf.fr/ark:/12148/cb12218558m	https://catalogue.bnf.fr/ark:/12148/cb12218558m	http://wikidata.org/entity/Q16679905	http://fr.wikipedia.org/wiki/Thierry_Cr%C3%A9pin-Leblond	
ENCPOS_1987_08	Recherches sur les maîtres et étudiants en droit à Bourges aux <small>XVI</small><sup>e</sup> et <small>XVII</small><sup>e</sup> siècles	Recherches sur les maîtres et étudiants en droit à Bourges aux xvie et xviie siècles	Devaux	Dominique	Dominique Devaux	110085949	1987	71-76		1500	1699		94064	149311648					
ENCPOS_1987_09	L’ordre de la Visitation à Paris aux <small>XVII</small><sup>e</sup> et <small>XVIII</small><sup>e</sup> siècles	L’ordre de la Visitation à Paris aux xviie et xviiie siècles	Duvignacq	Marie-Ange	Marie-Ange Duvignacq	030403731	1987	77-86	2	1600	1799				http://data.bnf.fr/ark:/12148/cb12182459h	https://catalogue.bnf.fr/ark:/12148/cb12182459h	http://wikidata.org/entity/Q42378312		
ENCPOS_1987_10	L’administration française au Levant (1918-1930)	L’administration française au Levant (1918-1930)	Fournié	Pierre	Pierre Fournié	034787720	1987	87-94	1	1918	1930		94066	149312369	http://data.bnf.fr/ark:/12148/cb125504891	https://catalogue.bnf.fr/ark:/12148/cb125504891	http://wikidata.org/entity/Q42378365		
ENCPOS_1987_11	Lenormant de Tournehem et le mouvement des Arts au milieu du <small>XVIII</small><sup>e</sup> siècle	Lenormant de Tournehem et le mouvement des Arts au milieu du xviiie siècle	Frank	Louis	Louis Frank	149831684	1987	95-104	1	1725	1775		94068	149312636					
ENCPOS_1987_12	Les archevêques de Lyon de la Bulle d’or aux Philippines, 1157–1308	Les archevêques de Lyon de la Bulle d’or aux Philippines (1157–1308)	Galland	Bruno	Bruno Galland	030387019	1987	105-113	1	1157	1308	1	94070	149313527	http://data.bnf.fr/ark:/12148/cb121811719	https://catalogue.bnf.fr/ark:/12148/cb121811719	http://wikidata.org/entity/Q2926789	http://fr.wikipedia.org/wiki/Bruno_Galland	http://dbpedia.org/resource/Bruno_Galland
ENCPOS_1987_13	Contribution à l’étude des dévots au <small>XVII</small><sup>e</sup> siècle : vie quotidienne et vie spirituelle à partir des biographies pieuses de l’époque	Contribution à l’étude des dévots au xviie siècle : vie quotidienne et vie spirituelle à partir des biographies pieuses de l’époque	Gastaldi	Nadine	Nadine Gastaldi	075470438	1987	115-124	2	1600	1699		94072	149313772	http://data.bnf.fr/ark:/12148/cb13166253k	https://catalogue.bnf.fr/ark:/12148/cb13166253k	http://wikidata.org/entity/Q42378531		
ENCPOS_1987_14	Recherches sur le chansonnier de troubadours M (Paris, Bibl. Nat. fr. 12474)	Recherches sur le chansonnier de troubadours M (Paris, Bibl. Nat. fr. 12474)	Lamur	Anne-Claude	Anne-Claude Lamur	031158005	1987	125-137	2	1000	1499		94074	149314302	http://data.bnf.fr/ark:/12148/cb12242762k	https://catalogue.bnf.fr/ark:/12148/cb12242762k	http://wikidata.org/entity/Q42378557		
ENCPOS_1987_15	L’immigration française en Aragon au <small>XVI</small><sup>e</sup> siècle et dans la première moitié du <small>XVII</small><sup>e</sup> siècle	L’immigration française en Aragon au xvie siècle et dans la première moitié du xviie siècle	Langé	Christine	Christine Langé	035375132	1987	139-142	2	1500	1650		94076	149314809	http://data.bnf.fr/ark:/12148/cb131852694	https://catalogue.bnf.fr/ark:/12148/cb131852694	http://wikidata.org/entity/Q42378607		
ENCPOS_1987_16	La pratique de la diplomatie sous le règne de Charles VI : ambassades et ambassadeurs français auprès des Anglais (1380-1422)	La pratique de la diplomatie sous le règne de Charles VI : ambassades et ambassadeurs français auprès des Anglais (1380-1422)	Le Bis	Isabelle	Isabelle Le Bis	057137528	1987	143-151	2	1380	1422		94078	149315082	http://data.bnf.fr/ark:/12148/cb129868547	https://catalogue.bnf.fr/ark:/12148/cb129868547	http://wikidata.org/entity/Q42378694		
ENCPOS_1987_17	Un diplomate français en Inde au temps de la guerre d’indépendance américaine : Piveron de Morlat (1778-1785)	Un diplomate français en Inde au temps de la guerre d’indépendance américaine : Piveron de Morlat (1778-1785)	Le Tréguilly	Philippe	Philippe Le Tréguilly	030309956	1987	153-162	1	1778	1785		94080	149315619	http://data.bnf.fr/ark:/12148/cb121752135	https://catalogue.bnf.fr/ark:/12148/cb121752135	http://wikidata.org/entity/Q42378722		
ENCPOS_1987_18	Un royaliste au service de la légitimité : Jean-Guillaume Hyde de Neuville (1776-1857)	Un royaliste au service de la légitimité : Jean-Guillaume Hyde de Neuville (1776-1857)	Malet	Françoise	Françoise Malet	149831714	1987	163-171	2	1776	1857		94086	149317700					
ENCPOS_1987_19	Sujets et protégés de la France dans le royaume de Tunis (1848-1881)	Sujets et protégés de la France dans la régence de Tunis (1848-1881)	Nunez	Juliette	Juliette Nunez	032670591	1987	173-182	2	1848	1881				http://data.bnf.fr/ark:/12148/cb12365601d	https://catalogue.bnf.fr/ark:/12148/cb12365601d	http://wikidata.org/entity/Q42378851		
ENCPOS_1987_20	Les canons de Jean de Lignères sur les tables astronomiques de 1321. Édition critique, traduction et étude	Les canons de Jean de Lignères sur les tables astronomiques de 1321. Édition critique, traduction et étude	Saby-Rousset	Marie-Madeleine	Marie-Madeleine Saby-Rousset	05738312X	1987	183-190	2	1321	1321		94089	149319002					
ENCPOS_1987_21	L’abbaye Saint-Léger de Soissons. Étude architecturale	L’abbaye Saint-Léger de Soissons. Étude architecturale	Sandron	Dany	Dany Sandron	032416458	1987	191-197	1	1070	1567		94091	149319347	http://data.bnf.fr/ark:/12148/cb123450360	https://catalogue.bnf.fr/ark:/12148/cb123450360	http://wikidata.org/entity/Q42378992		
ENCPOS_1987_22	L’évolution des techniques de fabrication du papier de 1791 à 1871	L’évolution des techniques de fabrication du papier de 1791 à 1871	Tsagouria-Ripoll	Maire-Lise	Maire-Lise Tsagouria-Ripoll	149831781	1987	199-203	2	1791	1871		94093	149320000					
ENCPOS_1987_NEXT		pages postliminaires					1987	-205											
ENCPOS_1987_PREV		pages liminaires					1987	0-8											
ENCPOS_1988_01	La fortune de Maximilien de Béthune, duc de Sully (1559-1641)	La fortune de Maximilien de Béthune, duc de Sully (1559-1641)	Aristide-Hastir	Isabelle	Isabelle Aristide-Hastir	030181585	1988	9-17	2	1559	1641		94099	149325649	http://data.bnf.fr/ark:/12148/cb121650331	https://catalogue.bnf.fr/ark:/12148/cb121650331	http://wikidata.org/entity/Q42379847		
ENCPOS_1988_02	Alphonse Poitevin (1819-1882), photographe et inventeur. La naissance des procédés de reproduction photographique et de la photographie inaltérable	Alphonse Poitevin (1819-1882), photographe et inventeur. La naissance des procédés de reproduction photographique et de la photographie inaltérable	Aubenas	Sylvie	Sylvie Aubenas	033783594	1988	19-30	2	1819	1882		94100	14932586X	http://data.bnf.fr/ark:/12148/cb12461144h	https://catalogue.bnf.fr/ark:/12148/cb12461144h	http://wikidata.org/entity/Q3507265	http://fr.wikipedia.org/wiki/Sylvie_Aubenas	
ENCPOS_1988_03	Le voyage de France en Allemagne de 1871 à 1914	Le voyage de France en Allemagne de 1871 à 1914	Barbey	Hélène	Hélène Barbey	03365879X	1988	31-42	2	1871	1914		94101	149326114					
ENCPOS_1988_04	L’architecture religieuse gothique des <small>XV</small><sup>e</sup> et <small>XVI</small><sup>e</sup> siècles dans l’ancien diocèse de Toul (Lorraine centrale et méridionale)	L’architecture religieuse gothique des xve et xvie siècles dans l’ancien diocèse de Toul (Lorraine centrale et méridionale)	Bertoldi	Sylvain	Sylvain Bertoldi	030134099	1988	43-51	1	1400	1599		94102	149326297	http://data.bnf.fr/ark:/12148/cb121611351	https://catalogue.bnf.fr/ark:/12148/cb121611351	http://wikidata.org/entity/Q42379872		
ENCPOS_1988_05	Histoire d’une ligne de chemin de fer dans Paris : la Petite Ceinture et le syndicat des compagnies (1851-1934)	Histoire d’une ligne de chemin de fer dans Paris : la Petite Ceinture et le syndicat des compagnies (1851-1934)	Berton	Jean-Maurice	Jean-Maurice Berton	149326726	1988	53-62	1	1851	1934		94103	149326483					
ENCPOS_1988_06	La politique du gouvernement Daladier à l’égard des États-Unis (1938-1940)	La politique du gouvernement Daladier à l’égard des États-Unis (1938-1940)	Daumas	Armelle	Armelle Daumas	14932698X	1988	63-69	2	1938	1940		94104	149326920					
ENCPOS_1988_07	Le <i>Speculum dominarum</i> de Durand de Champagne. Édition critique	Le Speculum dominarum de Durand de Champagne. Édition critique	Dubrulle	Anne	Anne Dubrulle	149327102	1988	71-74	2	1290	1310		94105	149327080					
ENCPOS_1988_08	Contribution à l’histoire de l’esclavage en Espagne au siècle d’or : les esclaves devant l’Inquisition	Contribution à l’étude de l’esclavage en Espagne au siècle d’or : les esclaves devant l’Inquisition	Fournié-Martinez	Christine	Christine Fournié-Martinez	116442824	1988	75-81	2	1600	1699		94106	14932720X	http://data.bnf.fr/ark:/12148/cb15514664s	https://catalogue.bnf.fr/ark:/12148/cb15514664s	http://wikidata.org/entity/Q42379979		
ENCPOS_1988_09	La vigne en Beaujolais au Moyen Âge	La vigne en Beaujolais au Moyen Âge	Genevois	Florence	Florence Genevois	149327412	1988	83-88	2	500	1499		94107	149327269					
ENCPOS_1988_10	Étienne Baluze (1630-1718) et l’histoire du Limousin : méthodes et desseins d’un érudit du <small>XVII</small><sup>e</sup> siècle	Étienne Baluze (1630-1718) et l’histoire du Limousin : méthodes et desseins d’un érudit du xviie siècle	Gillet	Patricia	Patricia Gillet	032301332	1988	89-98	2	1630	1718		94118	149341148	http://data.bnf.fr/ark:/12148/cb12335747c	https://catalogue.bnf.fr/ark:/12148/cb12335747c	http://wikidata.org/entity/Q42380060		
ENCPOS_1988_11	L’eau à Paris au <small>XVIII</small><sup>e</sup> siècle	L’eau à Paris au xviiie siècle	Jullien	Benoît	Benoît Jullien	057425663	1988	99-107	1	1700	1799		94119	149341261	http://data.bnf.fr/ark:/12148/cb13084705v	https://catalogue.bnf.fr/ark:/12148/cb13084705v	http://wikidata.org/entity/Q42380081		
ENCPOS_1988_12	Le théâtre de la Gaîté de 1808 à 1835	Le théâtre de la Gaîté de 1808 à 1835	Klotz	Pauline	Pauline Klotz	149341571	1988	109-116	2	1808	1835		94120	149341504	http://data.bnf.fr/ark:/12148/cb12361434v	https://catalogue.bnf.fr/ark:/12148/cb12361434v	http://wikidata.org/entity/Q42380105		
ENCPOS_1988_13	Chancellerie et culture au <small>XVI</small><sup>e</sup> siècle : les notaires et secrétaires du roi de 1515 à 1547	Chancellerie et culture au xvie siècle : les notaires et secrétaires du roi de 1515 à 1547	Le Clech-Charton	Sylvie	Sylvie Le Clech-Charton	031740278	1988	117-128	2	1515	1547		94121	149341776	http://data.bnf.fr/ark:/12148/cb12289941p	https://catalogue.bnf.fr/ark:/12148/cb12289941p	http://wikidata.org/entity/Q33262258		
ENCPOS_1988_14	Les chanoines du chapitre cathédral de Strasbourg aux <small>XV</small><sup>e</sup> et <small>XV</small><sup>e</sup> siècles (1440-1540)	Les chanoines du chapitre cathédral de Strasbourg aux xve et xve siècles (1440-1541)	Lorentz	Philippe	Philippe Lorentz	033977089	1988	129-138	1	1440	1540		94122	14934192X	http://data.bnf.fr/ark:/12148/cb12477915s	https://catalogue.bnf.fr/ark:/12148/cb12477915s	http://wikidata.org/entity/Q42380154		
ENCPOS_1988_15	Les plus anciennes chartes en langue française conservées dans le département de la Côte-d’Or (1239-1270)	Les plus anciennes chartes en langue française conservées dans le département de la Côte-d’Or (1239-1270)	Neveu	Valérie	Valérie Neveu	098590421	1988	139-141	2	1239	1270		94123	149342071	http://data.bnf.fr/ark:/12148/cb15056953d	https://catalogue.bnf.fr/ark:/12148/cb15056953d	http://wikidata.org/entity/Q42380219		
ENCPOS_1988_16	Les mineurs étrangers en France entre les deux guerres : l’exemple de La Machine (Nièvre) de 1913 à 1940	Les mineurs étrangers en France entre les deux guerres : l’exemple de La Machine (Nièvre) de 1913 à 1940	Peyceré	David	David Peyceré	031267823	1988	143-152	1	1913	1940		94125	149342241	http://data.bnf.fr/ark:/12148/cb12251569d	https://catalogue.bnf.fr/ark:/12148/cb12251569d	http://wikidata.org/entity/Q42380306		
ENCPOS_1988_17	Les libraires et imprimeurs parisiens au milieu du <small>XVIII</small><sup>e</sup> siècle (1740-1751). Une étude économique et sociale	Les libraires et imprimeurs parisiens au milieu du xviiie siècle (1740-1751). Une étude économique et sociale	Renier	Nathalie	Nathalie Renier	050839381	1988	153-162	2	1740	1751		94126	14934242X	http://data.bnf.fr/ark:/12148/cb13556648k	https://catalogue.bnf.fr/ark:/12148/cb13556648k	http://wikidata.org/entity/Q42380333		
ENCPOS_1988_18	L’action économique et sociale du conseil général d’Ille-et-Vilaine de 1820 à 1870	L’action économique et sociale du conseil général d’Ille-et-Vilaine de 1820 à 1870	Rit-Hardy	Christèle	Christèle Rit-Hardy	032115342	1988	163-170	2	1820	1870		94127	14934287X	http://data.bnf.fr/ark:/12148/cb123207698	https://catalogue.bnf.fr/ark:/12148/cb123207698	http://wikidata.org/entity/Q42380365		
ENCPOS_1988_19	Euripide au <small>XVI</small><sup>e</sup> siècle : la renaissance d’un tragique	Euripide au xvie siècle : la renaissance d’un tragique	Role	François	François Role	069654921	1988	171-177	1	1500	1599		94128	149343051	http://data.bnf.fr/ark:/12148/cb146251599	https://catalogue.bnf.fr/ark:/12148/cb146251599	http://wikidata.org/entity/Q38239727		
ENCPOS_1988_20	Les arts de l’intérieur de l’Exposition Internationale des arts et techniques appliquées à la vie moderne de Paris, 1937	Les arts de l’intérieur de l’Exposition Internationale des arts et techniques appliquées à la vie moderne de Paris, 1937	Sinclair	Stéphane	Stéphane Sinclair	031664822	1988	179-183	1	1937	1937		94130	149343248	http://data.bnf.fr/ark:/12148/cb12283716g	https://catalogue.bnf.fr/ark:/12148/cb12283716g	http://wikidata.org/entity/Q38219517		
ENCPOS_1988_21	La France et sa civilisation vues par les Italiens au <small>XVI</small><sup>e</sup> siècle	La France et sa civilisation vues par les Italiens au xvie siècle	Smith	Marc	Marc Smith	028959078	1988	185-198	1	1500	1599	1	94132	149343450	http://data.bnf.fr/ark:/12148/cb12068674t	https://catalogue.bnf.fr/ark:/12148/cb12068674t	http://wikidata.org/entity/Q3288405	http://fr.wikipedia.org/wiki/Marc_Smith_%28pal%C3%A9ographe%29	http://dbpedia.org/resource/Marc_Smith_(palaeographer)
ENCPOS_1988_22	La taille en Dauphiné, du « transport » de 1349 à la révision générale de 1474-1476	La taille en Dauphiné, du « transport » de 1349 à la révision générale de 1474-1476	Vernus-Moutin	Isabelle	Isabelle Vernus-Moutin	033514925	1988	199-208	2	1474	1476		94133	149343760	http://data.bnf.fr/ark:/12148/cb12437442g	https://catalogue.bnf.fr/ark:/12148/cb12437442g	http://wikidata.org/entity/Q42380404		
ENCPOS_1988_23	Les alpages et l’économie agro-pastorale d’une communauté montagnarde de Savoie : Saint-Maxime de Beaufort (<small>XVI</small><sup>e</sup>-<small>XVIII</small><sup>e</sup> siècle)	Les alpages et l’économie agro-pastorale d’une communauté montagnarde de Savoie : Saint-Maxime de Beaufort (xvie-xviiie siècle)	Viallet	Hélène	Hélène Viallet	032636989	1988	209-225	2	1500	1799		94135	14934399X	http://data.bnf.fr/ark:/12148/cb12362928j	https://catalogue.bnf.fr/ark:/12148/cb12362928j	http://wikidata.org/entity/Q33158716		
ENCPOS_1988_NEXT		pages postliminaires					1988	-227											
ENCPOS_1988_PREV		pages liminaires					1988	0-8											
ENCPOS_1989_01	Les avocats devant le parlement de Toulouse à travers les registres d’audience (1444-1483)	Les avocats devant le parlement de Toulouse à travers les registres d’audience (1444-1483)	Allabert	Marigeorges	Marigeorges Allabert	034186298	1989	7-15	2	1444	1483		94124	149342225	http://data.bnf.fr/ark:/12148/cb12497030m	https://catalogue.bnf.fr/ark:/12148/cb12497030m	http://wikidata.org/entity/Q42380742		
ENCPOS_1989_02	L’expédition Freycinet, à bord des corvettes l’Uranie et la Physicienne (1817-1820) : traditions et nouveautés de la circumnavigation française, au temps de la marine à voiles	L’expédition Freycinet, à bord des corvettes l’Uranie et la Physicienne (1817-1820) : traditions et nouveautés de la circumnavigation française, au temps de la marine à voiles	Allaire	Catherine	Catherine Allaire	149831870	1989	17-25	2	1817	1820		94129	14934323X					
ENCPOS_1989_03	Henri Queuille à Alger, ou la République en exil (août 1943-août 1944)	Henri Queuille à Alger, ou la République en exil (août 1943-août 1944)	Bastien	Hervé	Hervé Bastien	029692318	1989	27-36	1	1943	1944		94131	149343442	http://data.bnf.fr/ark:/12148/cb12126187n	https://catalogue.bnf.fr/ark:/12148/cb12126187n	http://wikidata.org/entity/Q38045639		
ENCPOS_1989_04	L’asile départemental d’aliénés du Cher au <small>XIX</small><sup>e</sup> siècle (1838-1914)	L’asile départemental d’aliénés du Cher au xixe siècle (1838-1914)	Boucard	Florence	Florence Boucard	200230514	1989	37-43	2	1838	1914		94134	149343779					
ENCPOS_1989_05	Les Francs-maçons, des Lumières à l’Empire : un exemple de sociabilité à Lille, Valenciennes et Dunkerque (1733-1815)	Les Francs-maçons, des Lumières à l’Empire : un exemple de sociabilité à Lille, Valenciennes et Dunkerque (1733-1815)	Bournonville	Jocelyne	Jocelyne Bournonville	149831935	1989	45-54	2	1733	1815		94136	149344341					
ENCPOS_1989_06	L’apanage du comte d’Artois (1773-1790)	L’apanage du comte d’Artois (1773-1790)	Bula	Sandrine	Sandrine Bula	033007527	1989	55-63	2	1773	1790		94137	149345887	http://data.bnf.fr/ark:/12148/cb12391838z	https://catalogue.bnf.fr/ark:/12148/cb12391838z	http://wikidata.org/entity/Q42380822		
ENCPOS_1989_07	Recherches sur les jubés des <small>XVI</small><sup>e</sup> et <small>XVII</small><sup>e</sup> siècles à Paris et dans les environs	Recherches sur les jubés des xvie et xviie siècles à Paris et dans les environs	Donetzkoff	Alexis	Alexis Donetzkoff	149831951	1989	65-70	1	1500	1699		94138	149346514					
ENCPOS_1989_08	La vigne en Beaujolais au Moyen Âge	La vigne en Beaujolais au Moyen Âge	Genevois	Florence	Florence Genevois	149327412	1989	71-78	2	500	1499								
ENCPOS_1989_09	Une famille protestante de Montauban : les Viçose (<small>XVI</small><sup>e</sup>-<small>XVII</small><sup>e</sup> siècles)	Une famille protestante de Montauban : les Viçose ( xvie-xviie siècles)	Gilbert	Nadine	Nadine Gilbert	149832206	1989	79-84	2	1500	1699		94139	149347693					
ENCPOS_1989_10	Les invasions normandes entre Loire et Seine (840-930). Leurs répercussions sur les établissements monastiques	Les invasions normandes entre Loire et Seine (840-930). Leurs répercussions sur les établissements monastiques	Goulet	Anne	Anne Goulet	034134883	1989	85-94	2	840	930		94141	149348088	http://data.bnf.fr/ark:/12148/cb12492327b	https://catalogue.bnf.fr/ark:/12148/cb12492327b	http://wikidata.org/entity/Q42380864		
ENCPOS_1989_11	Mutations et permanences sociales à Avignon (1390-1430)	Mutations et permanences sociales à Avignon (1390-1430)	Gros-Hayet	Catherine	Catherine Gros-Hayet	149832230	1989	95-103	2	1390	1430		94143	149348398					
ENCPOS_1989_12	Les seigneurs de Ribeaupierre (1451-1585)	Les seigneurs de Ribeaupierre (1451-1585)	Jordan	Benoît	Benoît Jordan	033253226	1989	105-111	1	1451	1585		94145	149348800	http://data.bnf.fr/ark:/12148/cb12413826z	https://catalogue.bnf.fr/ark:/12148/cb12413826z	http://wikidata.org/entity/Q42380922		
ENCPOS_1989_13	La librairie allemande à Paris de 1860 à 1914	La librairie allemande à Paris de 1860 à 1914	Kratz	Isabelle	Isabelle Kratz	14983232X	1989	113-121	2	1860	1914		94148	149349521					
ENCPOS_1989_14	Le Conseil ducal de Bretagne au début du principat de François II (1459-1463). Étude institutionnelle et édition complète du registre des procès verbaux du Conseil (31 mars 1459-6 avril 1463)	Le Conseil ducal de Bretagne au début du principat de François II (1459-1463). Étude institutionnelle et édition complète du registre des procès verbaux du Conseil (31 mars 1459-6 avril 1463)	Lejeune	Anne	Anne Lejeune	032535244	1989	123-130	2	1459	1463		94152	149350570	http://data.bnf.fr/ark:/12148/cb123546923	https://catalogue.bnf.fr/ark:/12148/cb123546923	http://wikidata.org/entity/Q42380991		
ENCPOS_1989_15	Les œuvres royaux à l’époque de Charles VII d’après les documents de la Chambre des comptes	Les œuvres royaux à l’époque de Charles VII d’après les documents de la Chambre des comptes	Le Pogam	Pierre-Yves	Pierre-Yves Le Pogam	03241644X	1989	131-137	1	1422	1461		94150	149350155					
ENCPOS_1989_16	L’opinion française sur l’Angleterre, de Fachoda à la Grande Guerre (1898-1914)	L’opinion française sur l’Angleterre, de Fachoda à la Grande Guerre (1898-1914)	Lorblanchet	Hélène	Hélène Lorblanchet	068865430	1989	139-145	2	1898	1914		94154	149350902	http://data.bnf.fr/ark:/12148/cb155248996	https://catalogue.bnf.fr/ark:/12148/cb155248996	http://wikidata.org/entity/Q42381005		
ENCPOS_1989_17	La section parisienne de Mauconseil sous la Révolution française	La section parisienne de Mauconseil sous la Révolution française	Loyer	Corinne	Corinne Loyer	149832346	1989	147-154	2	1789	1815		94156	149351372					
ENCPOS_1989_18	Aymeric de Peyrac, abbé de Moissac (1377-1406) et historien. Édition et présentation du <i>Stromatheus tragicus de-obito Karoli Magni</i>	Aymeric de Peyrac, abbé de Moissac (1377-1406) et historien. Édition et présentation du Stromatheus tragicus de-obito Karoli Magni	Mironneau	Paul	Paul Mironneau	03042674X	1989	155-160	1	1377	1406		94159	149352263					
ENCPOS_1989_19	<i>L’Histoire ancienne jusqu’à César</i> (première rédaction). Étude de la tradition manuscrite. Étude et édition partielle de la section d’histoire romaine	L'Histoire ancienne jusqu'à César (première rédaction). Étude de la tradition manuscrite. Étude et édition partielle de la section d’histoire romaine	Pavlidès	Christophe	Christophe Pavlidès	059427248	1989	161-165	1	1208	1499		94161	149352484					
ENCPOS_1989_20	Le chartrier de l’abbaye de Savigny au diocèse d’Avranches. Édition partielle (1202-1243) et commentaire	Le chartrier de l’abbaye de Savigny au diocèse d’Avranches. Édition partielle (1202-1243) et commentaire	Poulle	Béatrice	Béatrice Poulle	033609772	1989	167-171	2	1202	1243		94162	149352875	http://data.bnf.fr/ark:/12148/cb12445999j	https://catalogue.bnf.fr/ark:/12148/cb12445999j	http://wikidata.org/entity/Q42381109		
ENCPOS_1989_21	La côte de Seine-Inférieure (milieu du <small>XIX</small><sup>e</sup> siècle – 1940) : naissance et développement d’une économie balnéaire	La côte de Seine-Inférieure (milieu du xixe siècle – 1940) : naissance et développement d’une économie balnéaire	Riquier	Sylvain	Sylvain Riquier	035035145	1989	173-181	1	1850	1940		94163	149353340	http://data.bnf.fr/ark:/12148/cb12572088g	https://catalogue.bnf.fr/ark:/12148/cb12572088g	http://wikidata.org/entity/Q41987983		
ENCPOS_1989_22	Culture, art et société à Valenciennes dans la deuxième moitié du <small>XV</small><sup>e</sup> siècle (vers 1440-1507)	Culture, art et société à Valenciennes dans la deuxième moitié du xve siècle (vers 1440-1507)	Servant	Hélène	Hélène Servant	030434998	1989	183-193	2	1440	1507		94165	149353510	http://data.bnf.fr/ark:/12148/cb12185004v	https://catalogue.bnf.fr/ark:/12148/cb12185004v	http://wikidata.org/entity/Q42381127		
ENCPOS_1989_23	Le monnayage gentilice de la République romaine vu par les érudits des <small>XVI</small><sup>e</sup> et <small>XVII</small><sup>e</sup> siècles	Le monnayage gentilice de la République romaine vu par les érudits des xvie et xviie siècles	Simon	Jean-Michel	Jean-Michel Simon	149832354	1989	195-201	1	1500	1699		94166	149353723					
ENCPOS_1989_NEXT		pages postliminaires					1989	-203											
ENCPOS_1989_PREV		pages liminaires					1989	0-6											
ENCPOS_1990_01	Le Conseil du roi de Navarre sous Charles II et Charles III d’Évreux (1349-1425)	Le Conseil du roi de Navarre sous Charles II et Charles III d’Évreux (1349-1425)	Alzugaray Los Arcos	Teresa	Teresa Alzugaray Los Arcos	149348096	1990	7-16	2	1349	1425		94140	149347901					
ENCPOS_1990_02	Contribution à l’histoire du chat dans l’occident médiéval : étude critique des sources	Contribution à l’histoire du chat dans l’occident médiéval : étude critique des sources	Bobis	Laurence	Laurence Bobis	030629209	1990	17-28	2	500	1499		94142	149348304	http://data.bnf.fr/ark:/12148/cb12200685n	https://catalogue.bnf.fr/ark:/12148/cb12200685n	http://wikidata.org/entity/Q42346440		
ENCPOS_1990_03	L’actualité par l’image à Paris au temps des guerres de Religion : gravure de propagande (1549-1598)	L’actualité par l’image à Paris au temps des guerres de Religion : gravures de propagande (1549-1598)	Charrier	Anne-Laure	Anne-Laure Charrier	057037078	1990	29-34	2	1549	1598		94144	149348738					
